Gene_set,Term,Overlap,P-value,Adjusted P-value,Old P-value,Old Adjusted P-value,Odds Ratio,Combined Score,Genes
GO_Biological_Process_2021,regulation of microtubule-based movement (GO:0060632),1/11,0.6056824200245763,0.999995545160402,0,0,1.1331276989512646,0.5681496499571307,IGBP1
GO_Biological_Process_2021,regulation of mitochondrial depolarization (GO:0051900),1/11,0.6056824200245763,0.999995545160402,0,0,1.1331276989512646,0.5681496499571307,BCL2
GO_Biological_Process_2021,regulation of mitochondrial fusion (GO:0010635),1/11,0.6056824200245763,0.999995545160402,0,0,1.1331276989512646,0.5681496499571307,PID1
GO_Biological_Process_2021,regulation of monocyte chemotactic protein-1 production (GO:0071637),1/11,0.6056824200245763,0.999995545160402,0,0,1.1331276989512646,0.5681496499571307,TWIST1
GO_Biological_Process_2021,regulation of T cell mediated immunity (GO:0002709),1/11,0.6056824200245763,0.999995545160402,0,0,1.1331276989512646,0.5681496499571307,CLC
GO_Biological_Process_2021,response to corticosteroid (GO:0031960),1/11,0.6056824200245763,0.999995545160402,0,0,1.1331276989512646,0.5681496499571307,PDCD7
GO_Biological_Process_2021,response to hydroxyurea (GO:0072710),1/11,0.6056824200245763,0.999995545160402,0,0,1.1331276989512646,0.5681496499571307,DDX11
GO_Biological_Process_2021,ribonucleoside bisphosphate biosynthetic process (GO:0034030),1/11,0.6056824200245763,0.999995545160402,0,0,1.1331276989512646,0.5681496499571307,PPCDC
GO_Biological_Process_2021,signal peptide processing (GO:0006465),1/11,0.6056824200245763,0.999995545160402,0,0,1.1331276989512646,0.5681496499571307,HM13
GO_Biological_Process_2021,skeletal muscle cell differentiation (GO:0035914),1/11,0.6056824200245763,0.999995545160402,0,0,1.1331276989512646,0.5681496499571307,KLHL41
GO_Biological_Process_2021,somite development (GO:0061053),1/11,0.6056824200245763,0.999995545160402,0,0,1.1331276989512646,0.5681496499571307,PTCH1
GO_Biological_Process_2021,"synaptic transmission, GABAergic (GO:0051932)",1/11,0.6056824200245763,0.999995545160402,0,0,1.1331276989512646,0.5681496499571307,GABRE
GO_Biological_Process_2021,telomere maintenance via recombination (GO:0000722),1/11,0.6056824200245763,0.999995545160402,0,0,1.1331276989512646,0.5681496499571307,RAD50
GO_Biological_Process_2021,tetrahydrobiopterin metabolic process (GO:0046146),1/11,0.6056824200245763,0.999995545160402,0,0,1.1331276989512646,0.5681496499571307,DHFR
GO_Biological_Process_2021,V(D)J recombination (GO:0033151),1/11,0.6056824200245763,0.999995545160402,0,0,1.1331276989512646,0.5681496499571307,LIG3
GO_Biological_Process_2021,negative regulation of cellular macromolecule biosynthetic process (GO:2000113),43/547,0.6088427504081648,0.999995545160402,0,0,0.9657785216683252,0.4792147189871579,TRIM71;HDAC3;HDAC10;KDM8;PRDM5;TWIST2;NKAP;CBY1;TWIST1;CTCF;PRICKLE1;FOXO1;IKZF4;MECP2;FXR2;IFI16;CREB3L1;NACC1;ZNF703;CD38;MEN1;KLF10;PHC2;PCGF6;MTERF3;RING1;SFMBT1;NANOS3;DAB2IP;WWP2;PA2G4;PEX14;GATAD2A;DHFR;PER2;HIC2;BCL6;THAP7;CRY1;MAP3K10;GMNC;CNOT9;ATR
GO_Biological_Process_2021,acylglycerol homeostasis (GO:0055090),2/25,0.6131468816653112,0.999995545160402,0,0,0.9852388620504564,0.4819303386939937,LIPC;APOE
GO_Biological_Process_2021,cellular polysaccharide biosynthetic process (GO:0033692),2/25,0.6131468816653112,0.999995545160402,0,0,0.9852388620504564,0.4819303386939937,CSGALNACT1;NDST3
GO_Biological_Process_2021,energy derivation by oxidation of organic compounds (GO:0015980),2/25,0.6131468816653112,0.999995545160402,0,0,0.9852388620504564,0.4819303386939937,PID1;NR4A3
GO_Biological_Process_2021,glycolytic process through glucose-6-phosphate (GO:0061620),2/25,0.6131468816653112,0.999995545160402,0,0,0.9852388620504564,0.4819303386939937,ENO3;GCK
GO_Biological_Process_2021,negative regulation of actin filament polymerization (GO:0030837),2/25,0.6131468816653112,0.999995545160402,0,0,0.9852388620504564,0.4819303386939937,PRKCD;KANK4
GO_Biological_Process_2021,negative regulation of antigen receptor-mediated signaling pathway (GO:0050858),2/25,0.6131468816653112,0.999995545160402,0,0,0.9852388620504564,0.4819303386939937,LPXN;PTPRJ
GO_Biological_Process_2021,negative regulation of cellular carbohydrate metabolic process (GO:0010677),2/25,0.6131468816653112,0.999995545160402,0,0,0.9852388620504564,0.4819303386939937,CRY1;GCK
GO_Biological_Process_2021,negative regulation of endocytosis (GO:0045806),2/25,0.6131468816653112,0.999995545160402,0,0,0.9852388620504564,0.4819303386939937,RUBCN;LRSAM1
GO_Biological_Process_2021,negative regulation of sequestering of calcium ion (GO:0051283),2/25,0.6131468816653112,0.999995545160402,0,0,0.9852388620504564,0.4819303386939937,ITPR2;PKD2
GO_Biological_Process_2021,outflow tract septum morphogenesis (GO:0003148),2/25,0.6131468816653112,0.999995545160402,0,0,0.9852388620504564,0.4819303386939937,ACVR1;PARVA
GO_Biological_Process_2021,peroxisome organization (GO:0007031),2/25,0.6131468816653112,0.999995545160402,0,0,0.9852388620504564,0.4819303386939937,PEX7;PEX14
GO_Biological_Process_2021,phosphatidylglycerol metabolic process (GO:0046471),2/25,0.6131468816653112,0.999995545160402,0,0,0.9852388620504564,0.4819303386939937,PGS1;CRLS1
GO_Biological_Process_2021,regulation of epidermal cell differentiation (GO:0045604),2/25,0.6131468816653112,0.999995545160402,0,0,0.9852388620504564,0.4819303386939937,CBFB;MAFG
GO_Biological_Process_2021,regulation of myotube differentiation (GO:0010830),2/25,0.6131468816653112,0.999995545160402,0,0,0.9852388620504564,0.4819303386939937,HDAC3;MAML1
GO_Biological_Process_2021,regulation of protein processing (GO:0070613),2/25,0.6131468816653112,0.999995545160402,0,0,0.9852388620504564,0.4819303386939937,RHBDD1;ADAM8
GO_Biological_Process_2021,"G protein-coupled receptor signaling pathway, coupled to cyclic nucleotide second messenger (GO:0007187)",5/65,0.6150465114221618,0.999995545160402,0,0,0.9440321583178726,0.4588538028949241,VIPR1;HRH1;GALR3;HRH2;DRD4
GO_Biological_Process_2021,mitotic G1 DNA damage checkpoint signaling (GO:0031571),5/65,0.6150465114221618,0.999995545160402,0,0,0.9440321583178726,0.4588538028949241,PLK3;TFDP1;CARM1;CNOT9;FBXO31
GO_Biological_Process_2021,regulation of cell-matrix adhesion (GO:0001952),5/65,0.6150465114221618,0.999995545160402,0,0,0.9440321583178726,0.4588538028949241,ACER2;SLK;PTPRA;CDH13;SKAP1
GO_Biological_Process_2021,regulation of RNA metabolic process (GO:0051252),5/65,0.6150465114221618,0.999995545160402,0,0,0.9440321583178726,0.4588538028949241,HNRNPL;USP36;SRRM4;ESRP1;HNRNPF
GO_Biological_Process_2021,Golgi organization (GO:0007030),10/130,0.6161838952954343,0.999995545160402,0,0,0.9438585607940446,0.4570255920169034,PLK3;UBXN2A;FAM174B;COG4;GBF1;TRAPPC12;MYO18A;STX6;STX5;TMED4
GO_Biological_Process_2021,monocarboxylic acid metabolic process (GO:0032787),11/143,0.6174069400464728,0.999995545160402,0,0,0.9438237119801366,0.4551372075172321,PER2;MECR;PC;MTHFD1L;AASDH;PDZD11;BSG;CYP1A2;THEM4;AOAH;SLC27A4
GO_Biological_Process_2021,positive regulation of developmental growth (GO:0048639),4/52,0.6175730472061967,0.999995545160402,0,0,0.9440667490729296,0.4550004489953518,CPNE6;LIMK1;NGF;AGRN
GO_Biological_Process_2021,protein homotetramerization (GO:0051289),4/52,0.6175730472061967,0.999995545160402,0,0,0.9440667490729296,0.4550004489953518,APIP;CBY1;PKD2;UPB1
GO_Biological_Process_2021,cellular response to ketone (GO:1901655),3/39,0.622956015080987,0.999995545160402,0,0,0.9441012970969734,0.4468236618978927,NDOR1;ADCY3;DCPS
GO_Biological_Process_2021,DNA recombination (GO:0006310),3/39,0.622956015080987,0.999995545160402,0,0,0.9441012970969734,0.4468236618978927,RAD50;HDAC10;EXO1
GO_Biological_Process_2021,organophosphate biosynthetic process (GO:0090407),3/39,0.622956015080987,0.999995545160402,0,0,0.9441012970969734,0.4468236618978927,GK5;PPIP5K1;FADS1
GO_Biological_Process_2021,positive regulation of intracellular transport (GO:0032388),3/39,0.622956015080987,0.999995545160402,0,0,0.9441012970969734,0.4468236618978927,PLK3;PCM1;CAPN10
GO_Biological_Process_2021,regulation of peptidyl-threonine phosphorylation (GO:0010799),3/39,0.622956015080987,0.999995545160402,0,0,0.9441012970969734,0.4468236618978927,SPRED3;SPRED2;SPRED1
GO_Biological_Process_2021,regulation of T cell differentiation (GO:0045580),3/39,0.622956015080987,0.999995545160402,0,0,0.9441012970969734,0.4468236618978927,CBFB;CLPTM1;FANCA
GO_Biological_Process_2021,activation of GTPase activity (GO:0090630),8/105,0.6252369981926399,0.999995545160402,0,0,0.9341458117758276,0.4386977635325065,BCR;TBC1D2;RASGRF1;TBC1D8;TBC1D10A;TBC1D22B;SLC27A4;TBC1D16
GO_Biological_Process_2021,regulation of protein binding (GO:0043393),9/118,0.6254230911023717,0.999995545160402,0,0,0.935182604640052,0.4389063644653828,RALB;WNT3A;BAMBI;DDX11;PRKCD;SYMPK;TTBK1;PEX14;MEN1
GO_Biological_Process_2021,positive regulation of cellular component biogenesis (GO:0044089),7/92,0.6255384924299185,0.999995545160402,0,0,0.9328064104898924,0.4376190496370017,SMPD3;CDH5;LIMK1;DAB2IP;SNF8;SYNPO;RAB7A
GO_Biological_Process_2021,regulation of endothelial cell proliferation (GO:0001936),7/92,0.6255384924299185,0.999995545160402,0,0,0.9328064104898924,0.4376190496370017,NR4A1;APOH;TIE1;FGF18;CDH13;VASH1;APOE
GO_Biological_Process_2021,regulation of ion transport (GO:0043269),6/79,0.6265634655869106,0.999995545160402,0,0,0.931015190560152,0.4352544502786,SPTBN4;KCNJ6;NKAIN3;SYT12;KCNJ16;WWP2
GO_Biological_Process_2021,cell-cell junction assembly (GO:0007043),5/66,0.628715532078669,0.999995545160402,0,0,0.9285055303790668,0.430897484258642,CDH5;CDH20;ZNF703;FSCN1;CDH19
GO_Biological_Process_2021,embryonic organ development (GO:0048568),5/66,0.628715532078669,0.999995545160402,0,0,0.9285055303790668,0.430897484258642,TEAD4;KITLG;COL13A1;TEAD2;MFSD2A
GO_Biological_Process_2021,ERBB signaling pathway (GO:0038127),5/66,0.628715532078669,0.999995545160402,0,0,0.9285055303790668,0.430897484258642,PTPRR;DGKD;SHC3;TGFA;SLC30A10
GO_Biological_Process_2021,negative regulation of cysteine-type endopeptidase activity (GO:2000117),4/53,0.6327486455832456,0.999995545160402,0,0,0.9247496279104968,0.4232412777735413,IGBP1;IFI16;NGF;SH3RF1
GO_Biological_Process_2021,positive regulation of B cell activation (GO:0050871),4/53,0.6327486455832456,0.999995545160402,0,0,0.9247496279104968,0.4232412777735413,SH3KBP1;BCL2;CD38;EPHB2
GO_Biological_Process_2021,regulation of DNA replication (GO:0006275),4/53,0.6327486455832456,0.999995545160402,0,0,0.9247496279104968,0.4232412777735413,CTC1;DSCC1;GMNC;ATR
GO_Biological_Process_2021,DNA geometric change (GO:0032392),2/26,0.6347584629125906,0.999995545160402,0,0,0.9441358024691358,0.4291198488488759,RAD50;DDX11
GO_Biological_Process_2021,endothelial cell development (GO:0001885),2/26,0.6347584629125906,0.999995545160402,0,0,0.9441358024691358,0.4291198488488759,COL22A1;RAPGEF1
GO_Biological_Process_2021,histone methylation (GO:0016571),2/26,0.6347584629125906,0.999995545160402,0,0,0.9441358024691358,0.4291198488488759,CARM1;SMYD2
GO_Biological_Process_2021,maturation of LSU-rRNA (GO:0000470),2/26,0.6347584629125906,0.999995545160402,0,0,0.9441358024691358,0.4291198488488759,RPF2;RPF1
GO_Biological_Process_2021,mononuclear cell differentiation (GO:1903131),2/26,0.6347584629125906,0.999995545160402,0,0,0.9441358024691358,0.4291198488488759,IFI16;MT1G
GO_Biological_Process_2021,mRNA polyadenylation (GO:0006378),2/26,0.6347584629125906,0.999995545160402,0,0,0.9441358024691358,0.4291198488488759,CPSF1;SYMPK
GO_Biological_Process_2021,negative regulation of telomere maintenance via telomere lengthening (GO:1904357),2/26,0.6347584629125906,0.999995545160402,0,0,0.9441358024691358,0.4291198488488759,CTC1;EXOSC10
GO_Biological_Process_2021,positive regulation of filopodium assembly (GO:0051491),2/26,0.6347584629125906,0.999995545160402,0,0,0.9441358024691358,0.4291198488488759,FSCN1;AGRN
GO_Biological_Process_2021,positive regulation of protein insertion into mitochondrial membrane involved in apoptotic signaling pathway (GO:1900740),2/26,0.6347584629125906,0.999995545160402,0,0,0.9441358024691358,0.4291198488488759,TFDP1;BCL2
GO_Biological_Process_2021,purine-containing compound biosynthetic process (GO:0072522),2/26,0.6347584629125906,0.999995545160402,0,0,0.9441358024691358,0.4291198488488759,PRPSAP1;PNP
GO_Biological_Process_2021,regulation of glycogen biosynthetic process (GO:0005979),2/26,0.6347584629125906,0.999995545160402,0,0,0.9441358024691358,0.4291198488488759,PPP1R3E;GCK
GO_Biological_Process_2021,regulation of potassium ion transmembrane transporter activity (GO:1901016),2/26,0.6347584629125906,0.999995545160402,0,0,0.9441358024691358,0.4291198488488759,KCNG1;WWP2
GO_Biological_Process_2021,regulation of protein insertion into mitochondrial membrane involved in apoptotic signaling pathway (GO:1900739),2/26,0.6347584629125906,0.999995545160402,0,0,0.9441358024691358,0.4291198488488759,TFDP1;BCL2
GO_Biological_Process_2021,RNA polyadenylation (GO:0043631),2/26,0.6347584629125906,0.999995545160402,0,0,0.9441358024691358,0.4291198488488759,CPSF1;SYMPK
GO_Biological_Process_2021,snRNA processing (GO:0016180),2/26,0.6347584629125906,0.999995545160402,0,0,0.9441358024691358,0.4291198488488759,INTS11;INTS9
GO_Biological_Process_2021,negative regulation of nucleic acid-templated transcription (GO:1903507),36/464,0.635495459324321,0.999995545160402,0,0,0.9519628525297286,0.4315726766001825,HDAC3;HDAC10;KDM8;PRDM5;TWIST2;NKAP;CBY1;TWIST1;CTCF;PRICKLE1;FOXO1;IKZF4;MECP2;IFI16;CREB3L1;NACC1;ZNF703;CD38;MEN1;KLF10;PHC2;PCGF6;MTERF3;RING1;SFMBT1;DAB2IP;WWP2;PA2G4;PEX14;GATAD2A;PER2;HIC2;BCL6;THAP7;CRY1;MAP3K10
GO_Biological_Process_2021,small GTPase mediated signal transduction (GO:0007264),8/106,0.6359687099401763,0.999995545160402,0,0,0.9245631338037074,0.418462743205558,BCR;BRAP;ARHGAP33;DNMT1;SHC3;RALB;RHEBL1;RALGDS
GO_Biological_Process_2021,cellular response to growth factor stimulus (GO:0071363),12/158,0.636481451719917,0.999995545160402,0,0,0.9307581043137922,0.4205165138205411,ACVR1;ERN1;STAT5B;NR4A1;SYAP1;RAB35;PDE3A;RAPGEF1;DAB2IP;MT1G;WNT7A;ADAMTS12
GO_Biological_Process_2021,organonitrogen compound biosynthetic process (GO:1901566),12/158,0.636481451719917,0.999995545160402,0,0,0.9307581043137922,0.4205165138205411,ACER2;GSTZ1;HACD1;CHKA;PAH;ACER3;PLA2G4C;PEMT;ELOVL6;APOE;GSTT2B;MFSD2A
GO_Biological_Process_2021,actin crosslink formation (GO:0051764),1/12,0.6376790747819643,0.999995545160402,0,0,1.0300600078514943,0.4634447427104813,FLNA
GO_Biological_Process_2021,adipose tissue development (GO:0060612),1/12,0.6376790747819643,0.999995545160402,0,0,1.0300600078514943,0.4634447427104813,NAMPT
GO_Biological_Process_2021,axonal fasciculation (GO:0007413),1/12,0.6376790747819643,0.999995545160402,0,0,1.0300600078514943,0.4634447427104813,EPHB2
GO_Biological_Process_2021,C-terminal protein amino acid modification (GO:0018410),1/12,0.6376790747819643,0.999995545160402,0,0,1.0300600078514943,0.4634447427104813,AGBL1
GO_Biological_Process_2021,calcineurin-mediated signaling (GO:0097720),1/12,0.6376790747819643,0.999995545160402,0,0,1.0300600078514943,0.4634447427104813,NFATC3
GO_Biological_Process_2021,calcium ion-regulated exocytosis of neurotransmitter (GO:0048791),1/12,0.6376790747819643,0.999995545160402,0,0,1.0300600078514943,0.4634447427104813,DOC2B
GO_Biological_Process_2021,carboxylic acid catabolic process (GO:0046395),1/12,0.6376790747819643,0.999995545160402,0,0,1.0300600078514943,0.4634447427104813,BCKDK
GO_Biological_Process_2021,cardiocyte differentiation (GO:0035051),1/12,0.6376790747819643,0.999995545160402,0,0,1.0300600078514943,0.4634447427104813,CBY1
GO_Biological_Process_2021,cell differentiation in hindbrain (GO:0021533),1/12,0.6376790747819643,0.999995545160402,0,0,1.0300600078514943,0.4634447427104813,GRID2
GO_Biological_Process_2021,chromatin assembly or disassembly (GO:0006333),1/12,0.6376790747819643,0.999995545160402,0,0,1.0300600078514943,0.4634447427104813,HIRIP3
GO_Biological_Process_2021,double-strand break repair via break-induced replication (GO:0000727),1/12,0.6376790747819643,0.999995545160402,0,0,1.0300600078514943,0.4634447427104813,MUS81
GO_Biological_Process_2021,endoplasmic reticulum membrane organization (GO:0090158),1/12,0.6376790747819643,0.999995545160402,0,0,1.0300600078514943,0.4634447427104813,MOSPD3
GO_Biological_Process_2021,exit from mitosis (GO:0010458),1/12,0.6376790747819643,0.999995545160402,0,0,1.0300600078514943,0.4634447427104813,SPAST
GO_Biological_Process_2021,eye photoreceptor cell differentiation (GO:0001754),1/12,0.6376790747819643,0.999995545160402,0,0,1.0300600078514943,0.4634447427104813,SDK2
GO_Biological_Process_2021,glomerular visceral epithelial cell differentiation (GO:0072112),1/12,0.6376790747819643,0.999995545160402,0,0,1.0300600078514943,0.4634447427104813,PTPRO
GO_Biological_Process_2021,glutamine metabolic process (GO:0006541),1/12,0.6376790747819643,0.999995545160402,0,0,1.0300600078514943,0.4634447427104813,GLYATL1
GO_Biological_Process_2021,inositol phosphate catabolic process (GO:0071545),1/12,0.6376790747819643,0.999995545160402,0,0,1.0300600078514943,0.4634447427104813,SYNJ2
GO_Biological_Process_2021,intrinsic apoptotic signaling pathway in response to oxidative stress (GO:0008631),1/12,0.6376790747819643,0.999995545160402,0,0,1.0300600078514943,0.4634447427104813,PRKCD
GO_Biological_Process_2021,magnesium ion transport (GO:0015693),1/12,0.6376790747819643,0.999995545160402,0,0,1.0300600078514943,0.4634447427104813,NIPAL1
GO_Biological_Process_2021,maintenance of protein localization in endoplasmic reticulum (GO:0035437),1/12,0.6376790747819643,0.999995545160402,0,0,1.0300600078514943,0.4634447427104813,KDELR1
GO_Biological_Process_2021,megakaryocyte differentiation (GO:0030219),1/12,0.6376790747819643,0.999995545160402,0,0,1.0300600078514943,0.4634447427104813,IL11
GO_Biological_Process_2021,melanocyte differentiation (GO:0030318),1/12,0.6376790747819643,0.999995545160402,0,0,1.0300600078514943,0.4634447427104813,TYRP1
GO_Biological_Process_2021,microtubule anchoring at microtubule organizing center (GO:0072393),1/12,0.6376790747819643,0.999995545160402,0,0,1.0300600078514943,0.4634447427104813,PCM1
GO_Biological_Process_2021,mitochondrial genome maintenance (GO:0000002),1/12,0.6376790747819643,0.999995545160402,0,0,1.0300600078514943,0.4634447427104813,MPV17
GO_Biological_Process_2021,mitochondrion distribution (GO:0048311),1/12,0.6376790747819643,0.999995545160402,0,0,1.0300600078514943,0.4634447427104813,MSTO1
GO_Biological_Process_2021,morphogenesis of a polarized epithelium (GO:0001738),1/12,0.6376790747819643,0.999995545160402,0,0,1.0300600078514943,0.4634447427104813,LAMA3
GO_Biological_Process_2021,mRNA transcription (GO:0009299),1/12,0.6376790747819643,0.999995545160402,0,0,1.0300600078514943,0.4634447427104813,HSF1
GO_Biological_Process_2021,negative regulation of amyloid fibril formation (GO:1905907),1/12,0.6376790747819643,0.999995545160402,0,0,1.0300600078514943,0.4634447427104813,APOE
GO_Biological_Process_2021,negative regulation of calcineurin-mediated signaling (GO:0106057),1/12,0.6376790747819643,0.999995545160402,0,0,1.0300600078514943,0.4634447427104813,FHL2
GO_Biological_Process_2021,negative regulation of calcineurin-NFAT signaling cascade (GO:0070885),1/12,0.6376790747819643,0.999995545160402,0,0,1.0300600078514943,0.4634447427104813,FHL2
GO_Biological_Process_2021,negative regulation of complement activation (GO:0045916),1/12,0.6376790747819643,0.999995545160402,0,0,1.0300600078514943,0.4634447427104813,SUSD4
GO_Biological_Process_2021,negative regulation of fatty acid biosynthetic process (GO:0045717),1/12,0.6376790747819643,0.999995545160402,0,0,1.0300600078514943,0.4634447427104813,WDTC1
GO_Biological_Process_2021,negative regulation of glucose transmembrane transport (GO:0010829),1/12,0.6376790747819643,0.999995545160402,0,0,1.0300600078514943,0.4634447427104813,PID1
GO_Biological_Process_2021,negative regulation of heart contraction (GO:0045822),1/12,0.6376790747819643,0.999995545160402,0,0,1.0300600078514943,0.4634447427104813,SPTBN4
GO_Biological_Process_2021,negative regulation of histone acetylation (GO:0035067),1/12,0.6376790747819643,0.999995545160402,0,0,1.0300600078514943,0.4634447427104813,THAP7
GO_Biological_Process_2021,negative regulation of production of miRNAs involved in gene silencing by miRNA (GO:1903799),1/12,0.6376790747819643,0.999995545160402,0,0,1.0300600078514943,0.4634447427104813,LIN28B
GO_Biological_Process_2021,negative regulation of release of sequestered calcium ion into cytosol (GO:0051280),1/12,0.6376790747819643,0.999995545160402,0,0,1.0300600078514943,0.4634447427104813,PKD2
GO_Biological_Process_2021,negative regulation of ryanodine-sensitive calcium-release channel activity (GO:0060315),1/12,0.6376790747819643,0.999995545160402,0,0,1.0300600078514943,0.4634447427104813,PKD2
GO_Biological_Process_2021,nucleotide-sugar metabolic process (GO:0009225),1/12,0.6376790747819643,0.999995545160402,0,0,1.0300600078514943,0.4634447427104813,CSGALNACT1
GO_Biological_Process_2021,peptidyl-methionine modification (GO:0018206),1/12,0.6376790747819643,0.999995545160402,0,0,1.0300600078514943,0.4634447427104813,METAP2
GO_Biological_Process_2021,phospholipid efflux (GO:0033700),1/12,0.6376790747819643,0.999995545160402,0,0,1.0300600078514943,0.4634447427104813,APOE
GO_Biological_Process_2021,positive regulation of cardiocyte differentiation (GO:1905209),1/12,0.6376790747819643,0.999995545160402,0,0,1.0300600078514943,0.4634447427104813,WNT3A
GO_Biological_Process_2021,positive regulation of neuroinflammatory response (GO:0150078),1/12,0.6376790747819643,0.999995545160402,0,0,1.0300600078514943,0.4634447427104813,TTBK1
GO_Biological_Process_2021,positive regulation of sodium ion transmembrane transport (GO:1902307),1/12,0.6376790747819643,0.999995545160402,0,0,1.0300600078514943,0.4634447427104813,WNK2
GO_Biological_Process_2021,positive regulation of vascular permeability (GO:0043117),1/12,0.6376790747819643,0.999995545160402,0,0,1.0300600078514943,0.4634447427104813,PDE3A
GO_Biological_Process_2021,protein auto-ADP-ribosylation (GO:0070213),1/12,0.6376790747819643,0.999995545160402,0,0,1.0300600078514943,0.4634447427104813,PARP11
GO_Biological_Process_2021,protein insertion into mitochondrial inner membrane (GO:0045039),1/12,0.6376790747819643,0.999995545160402,0,0,1.0300600078514943,0.4634447427104813,TIMM29
GO_Biological_Process_2021,protein mono-ADP-ribosylation (GO:0140289),1/12,0.6376790747819643,0.999995545160402,0,0,1.0300600078514943,0.4634447427104813,PARP11
GO_Biological_Process_2021,purine nucleotide biosynthetic process (GO:0006164),1/12,0.6376790747819643,0.999995545160402,0,0,1.0300600078514943,0.4634447427104813,PRPSAP1
GO_Biological_Process_2021,regulation of amyloid precursor protein catabolic process (GO:1902991),1/12,0.6376790747819643,0.999995545160402,0,0,1.0300600078514943,0.4634447427104813,APOE
GO_Biological_Process_2021,regulation of axon regeneration (GO:0048679),1/12,0.6376790747819643,0.999995545160402,0,0,1.0300600078514943,0.4634447427104813,PTPRS
GO_Biological_Process_2021,regulation of B cell apoptotic process (GO:0002902),1/12,0.6376790747819643,0.999995545160402,0,0,1.0300600078514943,0.4634447427104813,BCL6
GO_Biological_Process_2021,regulation of cholesterol esterification (GO:0010872),1/12,0.6376790747819643,0.999995545160402,0,0,1.0300600078514943,0.4634447427104813,APOE
GO_Biological_Process_2021,regulation of feeding behavior (GO:0060259),1/12,0.6376790747819643,0.999995545160402,0,0,1.0300600078514943,0.4634447427104813,NR4A3
GO_Biological_Process_2021,regulation of flagellated sperm motility (GO:1901317),1/12,0.6376790747819643,0.999995545160402,0,0,1.0300600078514943,0.4634447427104813,TACR3
GO_Biological_Process_2021,regulation of glycogen metabolic process (GO:0070873),1/12,0.6376790747819643,0.999995545160402,0,0,1.0300600078514943,0.4634447427104813,PPP1R3E
GO_Biological_Process_2021,regulation of histone H3-K9 methylation (GO:0051570),1/12,0.6376790747819643,0.999995545160402,0,0,1.0300600078514943,0.4634447427104813,DNMT1
GO_Biological_Process_2021,regulation of leukocyte cell-cell adhesion (GO:1903037),1/12,0.6376790747819643,0.999995545160402,0,0,1.0300600078514943,0.4634447427104813,SKAP1
GO_Biological_Process_2021,regulation of MHC class II biosynthetic process (GO:0045346),1/12,0.6376790747819643,0.999995545160402,0,0,1.0300600078514943,0.4634447427104813,TMEM106A
GO_Biological_Process_2021,regulation of muscle system process (GO:0090257),1/12,0.6376790747819643,0.999995545160402,0,0,1.0300600078514943,0.4634447427104813,TNNC2
GO_Biological_Process_2021,regulation of myoblast fusion (GO:1901739),1/12,0.6376790747819643,0.999995545160402,0,0,1.0300600078514943,0.4634447427104813,CFLAR
GO_Biological_Process_2021,regulation of plasminogen activation (GO:0010755),1/12,0.6376790747819643,0.999995545160402,0,0,1.0300600078514943,0.4634447427104813,PLGRKT
GO_Biological_Process_2021,regulation of sequestering of calcium ion (GO:0051282),1/12,0.6376790747819643,0.999995545160402,0,0,1.0300600078514943,0.4634447427104813,UBASH3B
GO_Biological_Process_2021,regulation of ventricular cardiac muscle cell action potential (GO:0098911),1/12,0.6376790747819643,0.999995545160402,0,0,1.0300600078514943,0.4634447427104813,DSG2
GO_Biological_Process_2021,replicative senescence (GO:0090399),1/12,0.6376790747819643,0.999995545160402,0,0,1.0300600078514943,0.4634447427104813,ATR
GO_Biological_Process_2021,serine family amino acid biosynthetic process (GO:0009070),1/12,0.6376790747819643,0.999995545160402,0,0,1.0300600078514943,0.4634447427104813,PSAT1
GO_Biological_Process_2021,sno(s)RNA 3'-end processing (GO:0031126),1/12,0.6376790747819643,0.999995545160402,0,0,1.0300600078514943,0.4634447427104813,EXOSC10
