Gene_set,Term,Overlap,P-value,Adjusted P-value,Old P-value,Old Adjusted P-value,Odds Ratio,Combined Score,Genes
GO_Biological_Process_2021,cellular response to interferon-gamma (GO:0071346),8/121,0.6065568297442085,0.999987999384392,0,0,0.9505118358015336,0.4752149069679602,GBP6;HCK;OAS3;HLA-DPB1;HLA-C;B2M;CAMK2G;CD44
GO_Biological_Process_2021,protein homooligomerization (GO:0051260),8/121,0.6065568297442085,0.999987999384392,0,0,0.9505118358015336,0.4752149069679602,GOLGA2;RYR1;SCARA5;APIP;KIF25;B2M;UPB1;HSD17B10
GO_Biological_Process_2021,glial cell differentiation (GO:0010001),2/29,0.6065682320243636,0.999987999384392,0,0,0.9948083922072362,0.4973425733434451,CDK5;GPC1
GO_Biological_Process_2021,homologous chromosome pairing at meiosis (GO:0007129),2/29,0.6065682320243636,0.999987999384392,0,0,0.9948083922072362,0.4973425733434451,SYCE2;REC8
GO_Biological_Process_2021,hydrogen peroxide metabolic process (GO:0042743),2/29,0.6065682320243636,0.999987999384392,0,0,0.9948083922072362,0.4973425733434451,DUOX1;PRDX1
GO_Biological_Process_2021,lamellipodium organization (GO:0097581),2/29,0.6065682320243636,0.999987999384392,0,0,0.9948083922072362,0.4973425733434451,RAC1;PARVB
GO_Biological_Process_2021,mismatch repair (GO:0006298),2/29,0.6065682320243636,0.999987999384392,0,0,0.9948083922072362,0.4973425733434451,ERCC1;XPC
GO_Biological_Process_2021,positive regulation of viral genome replication (GO:0045070),2/29,0.6065682320243636,0.999987999384392,0,0,0.9948083922072362,0.4973425733434451,DDB1;IFIT1
GO_Biological_Process_2021,protein ADP-ribosylation (GO:0006471),2/29,0.6065682320243636,0.999987999384392,0,0,0.9948083922072362,0.4973425733434451,PARP2;ART4
GO_Biological_Process_2021,regulation of actin polymerization or depolymerization (GO:0008064),2/29,0.6065682320243636,0.999987999384392,0,0,0.9948083922072362,0.4973425733434451,DBNL;ABITRAM
GO_Biological_Process_2021,regulation of gluconeogenesis (GO:0006111),2/29,0.6065682320243636,0.999987999384392,0,0,0.9948083922072362,0.4973425733434451,DDB1;PGP
GO_Biological_Process_2021,telomere maintenance via telomerase (GO:0007004),2/29,0.6065682320243636,0.999987999384392,0,0,0.9948083922072362,0.4973425733434451,GAR1;TERF2IP
GO_Biological_Process_2021,cellular potassium ion homeostasis (GO:0030007),1/13,0.6069924038885891,0.999987999384392,0,0,1.1192539109506618,0.558775205697779,ATP1B1
GO_Biological_Process_2021,cellular response to interleukin-15 (GO:0071350),1/13,0.6069924038885891,0.999987999384392,0,0,1.1192539109506618,0.558775205697779,CD4
GO_Biological_Process_2021,central nervous system neuron axonogenesis (GO:0021955),1/13,0.6069924038885891,0.999987999384392,0,0,1.1192539109506618,0.558775205697779,EPHB6
GO_Biological_Process_2021,central nervous system projection neuron axonogenesis (GO:0021952),1/13,0.6069924038885891,0.999987999384392,0,0,1.1192539109506618,0.558775205697779,EPHB6
GO_Biological_Process_2021,detection of calcium ion (GO:0005513),1/13,0.6069924038885891,0.999987999384392,0,0,1.1192539109506618,0.558775205697779,CALM1
GO_Biological_Process_2021,DNA deamination (GO:0045006),1/13,0.6069924038885891,0.999987999384392,0,0,1.1192539109506618,0.558775205697779,APOBEC3H
GO_Biological_Process_2021,DNA replication-independent nucleosome organization (GO:0034724),1/13,0.6069924038885891,0.999987999384392,0,0,1.1192539109506618,0.558775205697779,SUPT16H
GO_Biological_Process_2021,embryonic hemopoiesis (GO:0035162),1/13,0.6069924038885891,0.999987999384392,0,0,1.1192539109506618,0.558775205697779,ATF4
GO_Biological_Process_2021,endochondral bone morphogenesis (GO:0060350),1/13,0.6069924038885891,0.999987999384392,0,0,1.1192539109506618,0.558775205697779,DLX5
GO_Biological_Process_2021,"endonucleolytic cleavage of tricistronic rRNA transcript (SSU-rRNA, 5.8S rRNA, LSU-rRNA) (GO:0000479)",1/13,0.6069924038885891,0.999987999384392,0,0,1.1192539109506618,0.558775205697779,NOP14
GO_Biological_Process_2021,entry into host (GO:0044409),1/13,0.6069924038885891,0.999987999384392,0,0,1.1192539109506618,0.558775205697779,CD4
GO_Biological_Process_2021,extracellular transport (GO:0006858),1/13,0.6069924038885891,0.999987999384392,0,0,1.1192539109506618,0.558775205697779,SPA17
GO_Biological_Process_2021,high-density lipoprotein particle assembly (GO:0034380),1/13,0.6069924038885891,0.999987999384392,0,0,1.1192539109506618,0.558775205697779,PRKACA
GO_Biological_Process_2021,homeostasis of number of cells (GO:0048872),1/13,0.6069924038885891,0.999987999384392,0,0,1.1192539109506618,0.558775205697779,CCN3
GO_Biological_Process_2021,interleukin-15-mediated signaling pathway (GO:0035723),1/13,0.6069924038885891,0.999987999384392,0,0,1.1192539109506618,0.558775205697779,CD4
GO_Biological_Process_2021,macrophage activation involved in immune response (GO:0002281),1/13,0.6069924038885891,0.999987999384392,0,0,1.1192539109506618,0.558775205697779,DYSF
GO_Biological_Process_2021,microtubule-based transport (GO:0099111),1/13,0.6069924038885891,0.999987999384392,0,0,1.1192539109506618,0.558775205697779,SPA17
GO_Biological_Process_2021,mitochondrial outer membrane permeabilization (GO:0097345),1/13,0.6069924038885891,0.999987999384392,0,0,1.1192539109506618,0.558775205697779,VDAC2
GO_Biological_Process_2021,muscle tissue development (GO:0060537),1/13,0.6069924038885891,0.999987999384392,0,0,1.1192539109506618,0.558775205697779,CSRP2
GO_Biological_Process_2021,negative regulation by host of viral transcription (GO:0043922),1/13,0.6069924038885891,0.999987999384392,0,0,1.1192539109506618,0.558775205697779,PSMC3
GO_Biological_Process_2021,negative regulation of autophagosome assembly (GO:1902902),1/13,0.6069924038885891,0.999987999384392,0,0,1.1192539109506618,0.558775205697779,NUPR1
GO_Biological_Process_2021,negative regulation of cell morphogenesis involved in differentiation (GO:0010771),1/13,0.6069924038885891,0.999987999384392,0,0,1.1192539109506618,0.558775205697779,SPRY4
GO_Biological_Process_2021,negative regulation of gluconeogenesis (GO:0045721),1/13,0.6069924038885891,0.999987999384392,0,0,1.1192539109506618,0.558775205697779,PGP
GO_Biological_Process_2021,negative regulation of hydrogen peroxide-induced cell death (GO:1903206),1/13,0.6069924038885891,0.999987999384392,0,0,1.1192539109506618,0.558775205697779,PDE8A
GO_Biological_Process_2021,negative regulation of mononuclear cell migration (GO:0071676),1/13,0.6069924038885891,0.999987999384392,0,0,1.1192539109506618,0.558775205697779,CCN3
GO_Biological_Process_2021,negative regulation of nucleocytoplasmic transport (GO:0046823),1/13,0.6069924038885891,0.999987999384392,0,0,1.1192539109506618,0.558775205697779,APOD
GO_Biological_Process_2021,negative regulation of substrate adhesion-dependent cell spreading (GO:1900025),1/13,0.6069924038885891,0.999987999384392,0,0,1.1192539109506618,0.558775205697779,SPRY4
GO_Biological_Process_2021,"positive regulation of CD4-positive, alpha-beta T cell activation (GO:2000516)",1/13,0.6069924038885891,0.999987999384392,0,0,1.1192539109506618,0.558775205697779,NCKAP1L
GO_Biological_Process_2021,positive regulation of histone deacetylation (GO:0031065),1/13,0.6069924038885891,0.999987999384392,0,0,1.1192539109506618,0.558775205697779,AKAP8L
GO_Biological_Process_2021,positive regulation of lipid transport (GO:0032370),1/13,0.6069924038885891,0.999987999384392,0,0,1.1192539109506618,0.558775205697779,CYP19A1
GO_Biological_Process_2021,positive regulation of neuron migration (GO:2001224),1/13,0.6069924038885891,0.999987999384392,0,0,1.1192539109506618,0.558775205697779,KIF20B
GO_Biological_Process_2021,positive regulation of protein acetylation (GO:1901985),1/13,0.6069924038885891,0.999987999384392,0,0,1.1192539109506618,0.558775205697779,TERF2IP
GO_Biological_Process_2021,positive regulation of protein localization to cell surface (GO:2000010),1/13,0.6069924038885891,0.999987999384392,0,0,1.1192539109506618,0.558775205697779,STX4
GO_Biological_Process_2021,positive regulation of purine nucleotide biosynthetic process (GO:1900373),1/13,0.6069924038885891,0.999987999384392,0,0,1.1192539109506618,0.558775205697779,TMSB4X
GO_Biological_Process_2021,protein localization to mitochondrion (GO:0070585),1/13,0.6069924038885891,0.999987999384392,0,0,1.1192539109506618,0.558775205697779,HK2
GO_Biological_Process_2021,pseudouridine synthesis (GO:0001522),1/13,0.6069924038885891,0.999987999384392,0,0,1.1192539109506618,0.558775205697779,GAR1
GO_Biological_Process_2021,pteridine-containing compound metabolic process (GO:0042558),1/13,0.6069924038885891,0.999987999384392,0,0,1.1192539109506618,0.558775205697779,CALM1
GO_Biological_Process_2021,pyrimidine deoxyribonucleotide catabolic process (GO:0009223),1/13,0.6069924038885891,0.999987999384392,0,0,1.1192539109506618,0.558775205697779,NTHL1
GO_Biological_Process_2021,regulation of actomyosin structure organization (GO:0110020),1/13,0.6069924038885891,0.999987999384392,0,0,1.1192539109506618,0.558775205697779,RAC1
GO_Biological_Process_2021,regulation of cell communication by electrical coupling (GO:0010649),1/13,0.6069924038885891,0.999987999384392,0,0,1.1192539109506618,0.558775205697779,CALM1
GO_Biological_Process_2021,regulation of fibrinolysis (GO:0051917),1/13,0.6069924038885891,0.999987999384392,0,0,1.1192539109506618,0.558775205697779,SERPINE1
GO_Biological_Process_2021,regulation of histone modification (GO:0031056),1/13,0.6069924038885891,0.999987999384392,0,0,1.1192539109506618,0.558775205697779,AKAP8L
GO_Biological_Process_2021,regulation of leukocyte adhesion to vascular endothelial cell (GO:1904994),1/13,0.6069924038885891,0.999987999384392,0,0,1.1192539109506618,0.558775205697779,ETS1
GO_Biological_Process_2021,regulation of membrane repolarization (GO:0060306),1/13,0.6069924038885891,0.999987999384392,0,0,1.1192539109506618,0.558775205697779,KCNE2
GO_Biological_Process_2021,regulation of mitotic cell cycle spindle assembly checkpoint (GO:0090266),1/13,0.6069924038885891,0.999987999384392,0,0,1.1192539109506618,0.558775205697779,ANAPC15
GO_Biological_Process_2021,regulation of nucleocytoplasmic transport (GO:0046822),1/13,0.6069924038885891,0.999987999384392,0,0,1.1192539109506618,0.558775205697779,RBM4
GO_Biological_Process_2021,regulation of platelet-derived growth factor receptor signaling pathway (GO:0010640),1/13,0.6069924038885891,0.999987999384392,0,0,1.1192539109506618,0.558775205697779,APOD
GO_Biological_Process_2021,regulation of protein acetylation (GO:1901983),1/13,0.6069924038885891,0.999987999384392,0,0,1.1192539109506618,0.558775205697779,TERF2IP
GO_Biological_Process_2021,"regulation of retrograde protein transport, ER to cytosol (GO:1904152)",1/13,0.6069924038885891,0.999987999384392,0,0,1.1192539109506618,0.558775205697779,ERLEC1
GO_Biological_Process_2021,response to iron ion (GO:0010039),1/13,0.6069924038885891,0.999987999384392,0,0,1.1192539109506618,0.558775205697779,B2M
GO_Biological_Process_2021,response to muramyl dipeptide (GO:0032495),1/13,0.6069924038885891,0.999987999384392,0,0,1.1192539109506618,0.558775205697779,NLRP1
GO_Biological_Process_2021,response to UV-B (GO:0010224),1/13,0.6069924038885891,0.999987999384392,0,0,1.1192539109506618,0.558775205697779,STK11
GO_Biological_Process_2021,sodium ion export across plasma membrane (GO:0036376),1/13,0.6069924038885891,0.999987999384392,0,0,1.1192539109506618,0.558775205697779,ATP1B1
GO_Biological_Process_2021,transport along microtubule (GO:0010970),1/13,0.6069924038885891,0.999987999384392,0,0,1.1192539109506618,0.558775205697779,COPG2
GO_Biological_Process_2021,tRNA 5'-leader removal (GO:0001682),1/13,0.6069924038885891,0.999987999384392,0,0,1.1192539109506618,0.558775205697779,RPP25
GO_Biological_Process_2021,positive regulation of supramolecular fiber organization (GO:1902905),6/91,0.6097729599539791,0.999987999384392,0,0,0.9477749360613812,0.468834489262767,VIL1;HCK;DCTN1;NCKAP1L;RAC1;CLU
GO_Biological_Process_2021,sensory perception of sound (GO:0007605),6/91,0.6097729599539791,0.999987999384392,0,0,0.9477749360613812,0.468834489262767,CEMIP;TMIE;COL4A3;MYH14;TBL1X;PDZD7
GO_Biological_Process_2021,positive regulation of programmed cell death (GO:0043068),19/286,0.6100136251069143,0.999987999384392,0,0,0.9550780982440568,0.4720702583917104,VAV3;NTRK1;PRR7;USP27X;UTP11;GADD45A;RASGRF2;PDCD5;CLU;PTPA;PIDD1;SFRP1;OBSCN;UBC;ITGA6;DNM1L;ATF4;HTATIP2;SPDEF
GO_Biological_Process_2021,action potential (GO:0001508),3/45,0.6117420146730048,0.999987999384392,0,0,0.9591984299142652,0.4713929174826201,KCNE2;SCN11A;MYH14
GO_Biological_Process_2021,cellular response to radiation (GO:0071478),3/45,0.6117420146730048,0.999987999384392,0,0,0.9591984299142652,0.4713929174826201,RAD51AP1;GADD45A;ADIRF
GO_Biological_Process_2021,regulation of T cell proliferation (GO:0042129),5/76,0.6129549565234113,0.999987999384392,0,0,0.945579341363168,0.4628268823347032,TNFSF18;IL4I1;GLMN;HLA-DPB1;NCKAP1L
GO_Biological_Process_2021,iron ion homeostasis (GO:0055072),4/61,0.6180867131117742,0.999987999384392,0,0,0.9422906034986164,0.4533609978428426,SCARA5;FTH1;B2M;SKP1
GO_Biological_Process_2021,positive regulation of cellular component biogenesis (GO:0044089),6/92,0.6204992847688273,0.999987999384392,0,0,0.9367037411526796,0.4470239010510626,VIL1;SLX4;ERCC1;CLU;WARS1;TRABD2A
GO_Biological_Process_2021,negative regulation of developmental process (GO:0051093),5/77,0.6246217738735077,0.999987999384392,0,0,0.9323960093330116,0.438793929530624,SFRP1;SPI1;WNT9B;SINHCAF;FOXM1
GO_Biological_Process_2021,cardiac muscle cell action potential (GO:0086001),2/30,0.6252255494964581,0.999987999384392,0,0,0.9592279108175062,0.4504944964093162,KCNE2;ATP1B1
GO_Biological_Process_2021,extrinsic apoptotic signaling pathway via death domain receptors (GO:0008625),2/30,0.6252255494964581,0.999987999384392,0,0,0.9592279108175062,0.4504944964093162,DAXX;SPI1
GO_Biological_Process_2021,"maturation of SSU-rRNA from tricistronic rRNA transcript (SSU-rRNA, 5.8S rRNA, LSU-rRNA) (GO:0000462)",2/30,0.6252255494964581,0.999987999384392,0,0,0.9592279108175062,0.4504944964093162,NOP14;NGDN
GO_Biological_Process_2021,morphogenesis of an epithelium (GO:0002009),2/30,0.6252255494964581,0.999987999384392,0,0,0.9592279108175062,0.4504944964093162,AHI1;TRAF3IP1
GO_Biological_Process_2021,ncRNA catabolic process (GO:0034661),2/30,0.6252255494964581,0.999987999384392,0,0,0.9592279108175062,0.4504944964093162,EXOSC10;NUDT16
GO_Biological_Process_2021,"negative regulation of gene expression, epigenetic (GO:0045814)",2/30,0.6252255494964581,0.999987999384392,0,0,0.9592279108175062,0.4504944964093162,SPI1;AEBP2
GO_Biological_Process_2021,non-motile cilium assembly (GO:1905515),2/30,0.6252255494964581,0.999987999384392,0,0,0.9592279108175062,0.4504944964093162,DCTN1;TBC1D32
GO_Biological_Process_2021,positive regulation of DNA recombination (GO:0045911),2/30,0.6252255494964581,0.999987999384392,0,0,0.9592279108175062,0.4504944964093162,RAD51AP1;HMCES
GO_Biological_Process_2021,protein N-linked glycosylation via asparagine (GO:0018279),2/30,0.6252255494964581,0.999987999384392,0,0,0.9592279108175062,0.4504944964093162,OST4;ST6GAL1
GO_Biological_Process_2021,regulation of cation transmembrane transport (GO:1904062),2/30,0.6252255494964581,0.999987999384392,0,0,0.9592279108175062,0.4504944964093162,CD63;KCNE2
GO_Biological_Process_2021,regulation of macrophage activation (GO:0043030),2/30,0.6252255494964581,0.999987999384392,0,0,0.9592279108175062,0.4504944964093162,CD74;IL31RA
GO_Biological_Process_2021,regulation of striated muscle contraction (GO:0006942),2/30,0.6252255494964581,0.999987999384392,0,0,0.9592279108175062,0.4504944964093162,PRKACA;CALM1
GO_Biological_Process_2021,respiratory tube development (GO:0030323),2/30,0.6252255494964581,0.999987999384392,0,0,0.9592279108175062,0.4504944964093162,WNT7B;FGF1
GO_Biological_Process_2021,RNA-dependent DNA biosynthetic process (GO:0006278),2/30,0.6252255494964581,0.999987999384392,0,0,0.9592279108175062,0.4504944964093162,GAR1;TERF2IP
GO_Biological_Process_2021,establishment of protein localization to extracellular region (GO:0035592),3/46,0.6267775381237363,0.999987999384392,0,0,0.9368410432326086,0.4376580390097863,SVBP;TANGO2;COPG2
GO_Biological_Process_2021,interleukin-12-mediated signaling pathway (GO:0035722),3/46,0.6267775381237363,0.999987999384392,0,0,0.9368410432326086,0.4376580390097863,ARF1;HNRNPDL;LCP1
GO_Biological_Process_2021,regulation of cellular protein localization (GO:1903827),3/46,0.6267775381237363,0.999987999384392,0,0,0.9368410432326086,0.4376580390097863,GPC1;GPC2;LCP1
GO_Biological_Process_2021,regulation of fibroblast proliferation (GO:0048145),3/46,0.6267775381237363,0.999987999384392,0,0,0.9368410432326086,0.4376580390097863,CD74;SFRP1;FTH1
GO_Biological_Process_2021,"regulation of synaptic transmission, glutamatergic (GO:0051966)",3/46,0.6267775381237363,0.999987999384392,0,0,0.9368410432326086,0.4376580390097863,CDK5;SHANK3;CACNG5
GO_Biological_Process_2021,regulation of neurogenesis (GO:0050767),4/62,0.6309897959292223,0.999987999384392,0,0,0.925994311093368,0.4263885147947902,SNW1;PAX6;ASCL1;B2M
GO_Biological_Process_2021,regulation of heart contraction (GO:0008016),6/93,0.6310557960363085,0.999987999384392,0,0,0.9258870564717642,0.4262422871026818,RYR1;TPM1;FXYD7;PRKACA;ATP1B1;CALM1
GO_Biological_Process_2021,2-oxoglutarate metabolic process (GO:0006103),1/14,0.6342454591490181,0.999987999384392,0,0,1.033101916134407,0.4703911792253607,D2HGDH
GO_Biological_Process_2021,amyloid precursor protein catabolic process (GO:0042987),1/14,0.6342454591490181,0.999987999384392,0,0,1.033101916134407,0.4703911792253607,ADAM19
GO_Biological_Process_2021,C4-dicarboxylate transport (GO:0015740),1/14,0.6342454591490181,0.999987999384392,0,0,1.033101916134407,0.4703911792253607,SLC25A10
GO_Biological_Process_2021,cardiac left ventricle morphogenesis (GO:0003214),1/14,0.6342454591490181,0.999987999384392,0,0,1.033101916134407,0.4703911792253607,NPY5R
GO_Biological_Process_2021,cardiolipin metabolic process (GO:0032048),1/14,0.6342454591490181,0.999987999384392,0,0,1.033101916134407,0.4703911792253607,HADHA
GO_Biological_Process_2021,cellular response to low-density lipoprotein particle stimulus (GO:0071404),1/14,0.6342454591490181,0.999987999384392,0,0,1.033101916134407,0.4703911792253607,CD9
GO_Biological_Process_2021,coenzyme A metabolic process (GO:0015936),1/14,0.6342454591490181,0.999987999384392,0,0,1.033101916134407,0.4703911792253607,DCAKD
GO_Biological_Process_2021,covalent chromatin modification (GO:0016569),1/14,0.6342454591490181,0.999987999384392,0,0,1.033101916134407,0.4703911792253607,PARP2
GO_Biological_Process_2021,defense response to protozoan (GO:0042832),1/14,0.6342454591490181,0.999987999384392,0,0,1.033101916134407,0.4703911792253607,GBP6
GO_Biological_Process_2021,dicarboxylic acid catabolic process (GO:0043649),1/14,0.6342454591490181,0.999987999384392,0,0,1.033101916134407,0.4703911792253607,ACOT4
GO_Biological_Process_2021,growth hormone receptor signaling pathway via JAK-STAT (GO:0060397),1/14,0.6342454591490181,0.999987999384392,0,0,1.033101916134407,0.4703911792253607,GHR
GO_Biological_Process_2021,manganese ion transport (GO:0006828),1/14,0.6342454591490181,0.999987999384392,0,0,1.033101916134407,0.4703911792253607,TRPC3
GO_Biological_Process_2021,N-terminal protein amino acid modification (GO:0031365),1/14,0.6342454591490181,0.999987999384392,0,0,1.033101916134407,0.4703911792253607,METAP2
GO_Biological_Process_2021,ncRNA transcription (GO:0098781),1/14,0.6342454591490181,0.999987999384392,0,0,1.033101916134407,0.4703911792253607,POLR1G
GO_Biological_Process_2021,negative regulation of bone mineralization (GO:0030502),1/14,0.6342454591490181,0.999987999384392,0,0,1.033101916134407,0.4703911792253607,RFLNA
GO_Biological_Process_2021,negative regulation of cell migration involved in sprouting angiogenesis (GO:0090051),1/14,0.6342454591490181,0.999987999384392,0,0,1.033101916134407,0.4703911792253607,HDAC5
GO_Biological_Process_2021,negative regulation of coagulation (GO:0050819),1/14,0.6342454591490181,0.999987999384392,0,0,1.033101916134407,0.4703911792253607,SERPINE1
GO_Biological_Process_2021,negative regulation of secretion (GO:0051048),1/14,0.6342454591490181,0.999987999384392,0,0,1.033101916134407,0.4703911792253607,CD74
GO_Biological_Process_2021,negative regulation of T cell mediated immunity (GO:0002710),1/14,0.6342454591490181,0.999987999384392,0,0,1.033101916134407,0.4703911792253607,IL4I1
GO_Biological_Process_2021,negative regulation of TORC1 signaling (GO:1904262),1/14,0.6342454591490181,0.999987999384392,0,0,1.033101916134407,0.4703911792253607,STK11
GO_Biological_Process_2021,negative regulation of translational initiation (GO:0045947),1/14,0.6342454591490181,0.999987999384392,0,0,1.033101916134407,0.4703911792253607,RBM4
GO_Biological_Process_2021,neurotransmitter biosynthetic process (GO:0042136),1/14,0.6342454591490181,0.999987999384392,0,0,1.033101916134407,0.4703911792253607,PAH
GO_Biological_Process_2021,nuclear migration (GO:0007097),1/14,0.6342454591490181,0.999987999384392,0,0,1.033101916134407,0.4703911792253607,DCTN1
GO_Biological_Process_2021,nuclear pore organization (GO:0006999),1/14,0.6342454591490181,0.999987999384392,0,0,1.033101916134407,0.4703911792253607,NUP133
GO_Biological_Process_2021,nucleoside phosphate biosynthetic process (GO:1901293),1/14,0.6342454591490181,0.999987999384392,0,0,1.033101916134407,0.4703911792253607,NMNAT3
GO_Biological_Process_2021,nucleoside triphosphate metabolic process (GO:0009141),1/14,0.6342454591490181,0.999987999384392,0,0,1.033101916134407,0.4703911792253607,ITPA
GO_Biological_Process_2021,ovarian follicle development (GO:0001541),1/14,0.6342454591490181,0.999987999384392,0,0,1.033101916134407,0.4703911792253607,INHA
GO_Biological_Process_2021,pancreas development (GO:0031016),1/14,0.6342454591490181,0.999987999384392,0,0,1.033101916134407,0.4703911792253607,SRP54
GO_Biological_Process_2021,positive regulation of alpha-beta T cell differentiation (GO:0046638),1/14,0.6342454591490181,0.999987999384392,0,0,1.033101916134407,0.4703911792253607,NCKAP1L
GO_Biological_Process_2021,positive regulation of glucose metabolic process (GO:0010907),1/14,0.6342454591490181,0.999987999384392,0,0,1.033101916134407,0.4703911792253607,DDB1
GO_Biological_Process_2021,positive regulation of glycogen biosynthetic process (GO:0045725),1/14,0.6342454591490181,0.999987999384392,0,0,1.033101916134407,0.4703911792253607,PPP1R3E
GO_Biological_Process_2021,positive regulation of glycoprotein biosynthetic process (GO:0010560),1/14,0.6342454591490181,0.999987999384392,0,0,1.033101916134407,0.4703911792253607,GOLGA2
GO_Biological_Process_2021,positive regulation of leukocyte degranulation (GO:0043302),1/14,0.6342454591490181,0.999987999384392,0,0,1.033101916134407,0.4703911792253607,STX4
GO_Biological_Process_2021,positive regulation of long-term synaptic potentiation (GO:1900273),1/14,0.6342454591490181,0.999987999384392,0,0,1.033101916134407,0.4703911792253607,SHANK3
GO_Biological_Process_2021,positive regulation of mitochondrial translation (GO:0070131),1/14,0.6342454591490181,0.999987999384392,0,0,1.033101916134407,0.4703911792253607,RCC1L
GO_Biological_Process_2021,positive regulation of potassium ion transmembrane transporter activity (GO:1901018),1/14,0.6342454591490181,0.999987999384392,0,0,1.033101916134407,0.4703911792253607,ATP1B1
GO_Biological_Process_2021,positive regulation of protein deacetylation (GO:0090312),1/14,0.6342454591490181,0.999987999384392,0,0,1.033101916134407,0.4703911792253607,AKAP8L
GO_Biological_Process_2021,positive regulation of regulatory T cell differentiation (GO:0045591),1/14,0.6342454591490181,0.999987999384392,0,0,1.033101916134407,0.4703911792253607,IL4I1
GO_Biological_Process_2021,positive regulation of sodium ion transmembrane transporter activity (GO:2000651),1/14,0.6342454591490181,0.999987999384392,0,0,1.033101916134407,0.4703911792253607,ATP1B1
GO_Biological_Process_2021,potassium ion export across plasma membrane (GO:0097623),1/14,0.6342454591490181,0.999987999384392,0,0,1.033101916134407,0.4703911792253607,KCNE2
GO_Biological_Process_2021,regulation of histone deacetylation (GO:0031063),1/14,0.6342454591490181,0.999987999384392,0,0,1.033101916134407,0.4703911792253607,AKAP8L
GO_Biological_Process_2021,regulation of IRE1-mediated unfolded protein response (GO:1903894),1/14,0.6342454591490181,0.999987999384392,0,0,1.033101916134407,0.4703911792253607,DDRGK1
GO_Biological_Process_2021,regulation of macrophage cytokine production (GO:0010935),1/14,0.6342454591490181,0.999987999384392,0,0,1.033101916134407,0.4703911792253607,CD74
GO_Biological_Process_2021,regulation of response to interferon-gamma (GO:0060330),1/14,0.6342454591490181,0.999987999384392,0,0,1.033101916134407,0.4703911792253607,CDC37
GO_Biological_Process_2021,regulation of retinoic acid receptor signaling pathway (GO:0048385),1/14,0.6342454591490181,0.999987999384392,0,0,1.033101916134407,0.4703911792253607,SNW1
GO_Biological_Process_2021,renal absorption (GO:0070293),1/14,0.6342454591490181,0.999987999384392,0,0,1.033101916134407,0.4703911792253607,CLDN4
GO_Biological_Process_2021,respiratory electron transport chain (GO:0022904),1/14,0.6342454591490181,0.999987999384392,0,0,1.033101916134407,0.4703911792253607,ETFB
GO_Biological_Process_2021,ribonucleoside monophosphate biosynthetic process (GO:0009156),1/14,0.6342454591490181,0.999987999384392,0,0,1.033101916134407,0.4703911792253607,GART
GO_Biological_Process_2021,sequestering of extracellular ligand from receptor (GO:0035581),1/14,0.6342454591490181,0.999987999384392,0,0,1.033101916134407,0.4703911792253607,NOG
GO_Biological_Process_2021,sulfate transport (GO:0008272),1/14,0.6342454591490181,0.999987999384392,0,0,1.033101916134407,0.4703911792253607,SLC25A10
