Gene_set,Term,Overlap,P-value,Adjusted P-value,Old P-value,Old Adjusted P-value,Odds Ratio,Combined Score,Genes
GO_Biological_Process_2021,ATP synthesis coupled proton transport (GO:0015986),2/19,0.3830850028728552,0.999987999384392,0,0,1.5808398503910237,1.5168132672860732,ATP5F1A;ATP5F1B
GO_Biological_Process_2021,epoxygenase P450 pathway (GO:0019373),2/19,0.3830850028728552,0.999987999384392,0,0,1.5808398503910237,1.5168132672860732,CYP1A2;CYP2E1
GO_Biological_Process_2021,histone H4-K16 acetylation (GO:0043984),2/19,0.3830850028728552,0.999987999384392,0,0,1.5808398503910237,1.5168132672860732,MEAF6;JADE2
GO_Biological_Process_2021,leukocyte adhesion to vascular endothelial cell (GO:0061756),2/19,0.3830850028728552,0.999987999384392,0,0,1.5808398503910237,1.5168132672860732,SELP;MADCAM1
GO_Biological_Process_2021,maintenance of protein localization in organelle (GO:0072595),2/19,0.3830850028728552,0.999987999384392,0,0,1.5808398503910237,1.5168132672860732,HK2;SKP1
GO_Biological_Process_2021,negative regulation of nervous system development (GO:0051961),2/19,0.3830850028728552,0.999987999384392,0,0,1.5808398503910237,1.5168132672860732,PAX6;B2M
GO_Biological_Process_2021,negative regulation of striated muscle cell differentiation (GO:0051154),2/19,0.3830850028728552,0.999987999384392,0,0,1.5808398503910237,1.5168132672860732,HDAC5;CCN3
GO_Biological_Process_2021,peptidyl-lysine dimethylation (GO:0018027),2/19,0.3830850028728552,0.999987999384392,0,0,1.5808398503910237,1.5168132672860732,KMT2B;EEF1AKMT2
GO_Biological_Process_2021,positive regulation of actin cytoskeleton reorganization (GO:2000251),2/19,0.3830850028728552,0.999987999384392,0,0,1.5808398503910237,1.5168132672860732,HCK;CDK5
GO_Biological_Process_2021,positive regulation of focal adhesion assembly (GO:0051894),2/19,0.3830850028728552,0.999987999384392,0,0,1.5808398503910237,1.5168132672860732,SFRP1;RAC1
GO_Biological_Process_2021,positive regulation of mitochondrial fission (GO:0090141),2/19,0.3830850028728552,0.999987999384392,0,0,1.5808398503910237,1.5168132672860732,DNM1L;AURKA
GO_Biological_Process_2021,postsynaptic membrane organization (GO:0001941),2/19,0.3830850028728552,0.999987999384392,0,0,1.5808398503910237,1.5168132672860732,DNAJA3;SHANK3
GO_Biological_Process_2021,pyroptosis (GO:0070269),2/19,0.3830850028728552,0.999987999384392,0,0,1.5808398503910237,1.5168132672860732,APIP;NLRP1
GO_Biological_Process_2021,Rac protein signal transduction (GO:0016601),2/19,0.3830850028728552,0.999987999384392,0,0,1.5808398503910237,1.5168132672860732,DBNL;RAC1
GO_Biological_Process_2021,regulation of bicellular tight junction assembly (GO:2000810),2/19,0.3830850028728552,0.999987999384392,0,0,1.5808398503910237,1.5168132672860732,PRKCH;PRKACA
GO_Biological_Process_2021,regulation of epithelial cell differentiation (GO:0030856),2/19,0.3830850028728552,0.999987999384392,0,0,1.5808398503910237,1.5168132672860732,MAFG;MAFF
GO_Biological_Process_2021,regulation of histone H3-K4 methylation (GO:0051569),2/19,0.3830850028728552,0.999987999384392,0,0,1.5808398503910237,1.5168132672860732,SNW1;MYB
GO_Biological_Process_2021,regulation of mitochondrial membrane permeability (GO:0046902),2/19,0.3830850028728552,0.999987999384392,0,0,1.5808398503910237,1.5168132672860732,HEBP2;SPG7
GO_Biological_Process_2021,regulation of nervous system process (GO:0031644),2/19,0.3830850028728552,0.999987999384392,0,0,1.5808398503910237,1.5168132672860732,NPTXR;CACNG5
GO_Biological_Process_2021,regulation of RIG-I signaling pathway (GO:0039535),2/19,0.3830850028728552,0.999987999384392,0,0,1.5808398503910237,1.5168132672860732,DHX58;UFD1
GO_Biological_Process_2021,response to ATP (GO:0033198),2/19,0.3830850028728552,0.999987999384392,0,0,1.5808398503910237,1.5168132672860732,P2RY11;TRPC3
GO_Biological_Process_2021,gene silencing by miRNA (GO:0035195),3/32,0.3840580608676026,0.999987999384392,0,0,1.3901563318124015,1.3303261408622384,RBM4;LIMD1;WTIP
GO_Biological_Process_2021,negative regulation of cell-matrix adhesion (GO:0001953),3/32,0.3840580608676026,0.999987999384392,0,0,1.3901563318124015,1.3303261408622384,SERPINE1;APOD;PLET1
GO_Biological_Process_2021,protein K63-linked deubiquitination (GO:0070536),3/32,0.3840580608676026,0.999987999384392,0,0,1.3901563318124015,1.3303261408622384,USP27X;USP20;ABRAXAS1
GO_Biological_Process_2021,protein transmembrane import into intracellular organelle (GO:0044743),3/32,0.3840580608676026,0.999987999384392,0,0,1.3901563318124015,1.3303261408622384,TOMM40;TIMM17B;TOMM20
GO_Biological_Process_2021,regulation of intracellular protein transport (GO:0033157),3/32,0.3840580608676026,0.999987999384392,0,0,1.3901563318124015,1.3303261408622384,PLK3;LCP1;KIF20B
GO_Biological_Process_2021,RNA biosynthetic process (GO:0032774),3/32,0.3840580608676026,0.999987999384392,0,0,1.3901563318124015,1.3303261408622384,TCEA2;TAF6;TTF1
GO_Biological_Process_2021,protein polymerization (GO:0051258),5/59,0.3890418668285413,0.999987999384392,0,0,1.2444015340467187,1.174800058617623,VIL1;TPPP3;CATIP;RAC1;WASHC3
GO_Biological_Process_2021,adenylate cyclase-activating dopamine receptor signaling pathway (GO:0007191),1/7,0.3951684614757873,0.999987999384392,0,0,2.2392298435619735,2.0789975429157423,GNAS
GO_Biological_Process_2021,cardiolipin acyl-chain remodeling (GO:0035965),1/7,0.3951684614757873,0.999987999384392,0,0,2.2392298435619735,2.0789975429157423,HADHA
GO_Biological_Process_2021,cellular cation homeostasis (GO:0030003),1/7,0.3951684614757873,0.999987999384392,0,0,2.2392298435619735,2.0789975429157423,TESMIN
GO_Biological_Process_2021,cellular response to caffeine (GO:0071313),1/7,0.3951684614757873,0.999987999384392,0,0,2.2392298435619735,2.0789975429157423,RYR1
GO_Biological_Process_2021,cellular response to prostaglandin E stimulus (GO:0071380),1/7,0.3951684614757873,0.999987999384392,0,0,2.2392298435619735,2.0789975429157423,SFRP1
GO_Biological_Process_2021,detection of stimulus involved in sensory perception of pain (GO:0062149),1/7,0.3951684614757873,0.999987999384392,0,0,2.2392298435619735,2.0789975429157423,ANO1
GO_Biological_Process_2021,endothelial cell morphogenesis (GO:0001886),1/7,0.3951684614757873,0.999987999384392,0,0,2.2392298435619735,2.0789975429157423,COL18A1
GO_Biological_Process_2021,exocrine system development (GO:0035272),1/7,0.3951684614757873,0.999987999384392,0,0,2.2392298435619735,2.0789975429157423,SRP54
GO_Biological_Process_2021,G protein-coupled receptor internalization (GO:0002031),1/7,0.3951684614757873,0.999987999384392,0,0,2.2392298435619735,2.0789975429157423,ARR3
GO_Biological_Process_2021,G-quadruplex DNA unwinding (GO:0044806),1/7,0.3951684614757873,0.999987999384392,0,0,2.2392298435619735,2.0789975429157423,DDX11
GO_Biological_Process_2021,gas homeostasis (GO:0033483),1/7,0.3951684614757873,0.999987999384392,0,0,2.2392298435619735,2.0789975429157423,WNT7B
GO_Biological_Process_2021,glandular epithelial cell development (GO:0002068),1/7,0.3951684614757873,0.999987999384392,0,0,2.2392298435619735,2.0789975429157423,PAX6
GO_Biological_Process_2021,glial cell migration (GO:0008347),1/7,0.3951684614757873,0.999987999384392,0,0,2.2392298435619735,2.0789975429157423,CD9
GO_Biological_Process_2021,glyceraldehyde-3-phosphate metabolic process (GO:0019682),1/7,0.3951684614757873,0.999987999384392,0,0,2.2392298435619735,2.0789975429157423,GLYCTK
GO_Biological_Process_2021,heme transport (GO:0015886),1/7,0.3951684614757873,0.999987999384392,0,0,2.2392298435619735,2.0789975429157423,SLC48A1
GO_Biological_Process_2021,hemostasis (GO:0007599),1/7,0.3951684614757873,0.999987999384392,0,0,2.2392298435619735,2.0789975429157423,HPS4
GO_Biological_Process_2021,histone H3-K14 acetylation (GO:0044154),1/7,0.3951684614757873,0.999987999384392,0,0,2.2392298435619735,2.0789975429157423,MEAF6
GO_Biological_Process_2021,histone H3-K4 dimethylation (GO:0044648),1/7,0.3951684614757873,0.999987999384392,0,0,2.2392298435619735,2.0789975429157423,KMT2B
GO_Biological_Process_2021,hyaluronan biosynthetic process (GO:0030213),1/7,0.3951684614757873,0.999987999384392,0,0,2.2392298435619735,2.0789975429157423,CEMIP
GO_Biological_Process_2021,iron coordination entity transport (GO:1901678),1/7,0.3951684614757873,0.999987999384392,0,0,2.2392298435619735,2.0789975429157423,SLC48A1
GO_Biological_Process_2021,L-methionine salvage (GO:0071267),1/7,0.3951684614757873,0.999987999384392,0,0,2.2392298435619735,2.0789975429157423,APIP
GO_Biological_Process_2021,left/right pattern formation (GO:0060972),1/7,0.3951684614757873,0.999987999384392,0,0,2.2392298435619735,2.0789975429157423,AHI1
GO_Biological_Process_2021,lipid hydroxylation (GO:0002933),1/7,0.3951684614757873,0.999987999384392,0,0,2.2392298435619735,2.0789975429157423,CYP2E1
GO_Biological_Process_2021,long-term synaptic depression (GO:0060292),1/7,0.3951684614757873,0.999987999384392,0,0,2.2392298435619735,2.0789975429157423,ARF1
GO_Biological_Process_2021,lymphoid progenitor cell differentiation (GO:0002320),1/7,0.3951684614757873,0.999987999384392,0,0,2.2392298435619735,2.0789975429157423,SPI1
GO_Biological_Process_2021,maintenance of synapse structure (GO:0099558),1/7,0.3951684614757873,0.999987999384392,0,0,2.2392298435619735,2.0789975429157423,DCTN1
GO_Biological_Process_2021,membrane biogenesis (GO:0044091),1/7,0.3951684614757873,0.999987999384392,0,0,2.2392298435619735,2.0789975429157423,TLCD2
GO_Biological_Process_2021,membrane fission (GO:0090148),1/7,0.3951684614757873,0.999987999384392,0,0,2.2392298435619735,2.0789975429157423,DNM1L
GO_Biological_Process_2021,metanephric nephron tubule development (GO:0072234),1/7,0.3951684614757873,0.999987999384392,0,0,2.2392298435619735,2.0789975429157423,WNT7B
GO_Biological_Process_2021,mitochondrion-endoplasmic reticulum membrane tethering (GO:1990456),1/7,0.3951684614757873,0.999987999384392,0,0,2.2392298435619735,2.0789975429157423,CALM1
GO_Biological_Process_2021,mRNA transcription by RNA polymerase II (GO:0042789),1/7,0.3951684614757873,0.999987999384392,0,0,2.2392298435619735,2.0789975429157423,ATF4
GO_Biological_Process_2021,negative regulation of acute inflammatory response (GO:0002674),1/7,0.3951684614757873,0.999987999384392,0,0,2.2392298435619735,2.0789975429157423,NLRP3
GO_Biological_Process_2021,negative regulation of nervous system process (GO:0031645),1/7,0.3951684614757873,0.999987999384392,0,0,2.2392298435619735,2.0789975429157423,CCN3
GO_Biological_Process_2021,negative regulation of protein import (GO:1904590),1/7,0.3951684614757873,0.999987999384392,0,0,2.2392298435619735,2.0789975429157423,APOD
GO_Biological_Process_2021,negative regulation of protein import into nucleus (GO:0042308),1/7,0.3951684614757873,0.999987999384392,0,0,2.2392298435619735,2.0789975429157423,APOD
GO_Biological_Process_2021,negative regulation of stress-activated protein kinase signaling cascade (GO:0070303),1/7,0.3951684614757873,0.999987999384392,0,0,2.2392298435619735,2.0789975429157423,FOXM1
GO_Biological_Process_2021,negative regulation of telomere capping (GO:1904354),1/7,0.3951684614757873,0.999987999384392,0,0,2.2392298435619735,2.0789975429157423,ERCC1
GO_Biological_Process_2021,"neurotransmitter receptor transport, endosome to plasma membrane (GO:0099639)",1/7,0.3951684614757873,0.999987999384392,0,0,2.2392298435619735,2.0789975429157423,GRIPAP1
GO_Biological_Process_2021,nicotinamide nucleotide biosynthetic process (GO:0019359),1/7,0.3951684614757873,0.999987999384392,0,0,2.2392298435619735,2.0789975429157423,NMNAT3
GO_Biological_Process_2021,noradrenergic neuron differentiation (GO:0003357),1/7,0.3951684614757873,0.999987999384392,0,0,2.2392298435619735,2.0789975429157423,ASCL1
GO_Biological_Process_2021,pentose metabolic process (GO:0019321),1/7,0.3951684614757873,0.999987999384392,0,0,2.2392298435619735,2.0789975429157423,XYLB
GO_Biological_Process_2021,pharyngeal arch artery morphogenesis (GO:0061626),1/7,0.3951684614757873,0.999987999384392,0,0,2.2392298435619735,2.0789975429157423,NOG
GO_Biological_Process_2021,polyadenylation-dependent snoRNA 3'-end processing (GO:0071051),1/7,0.3951684614757873,0.999987999384392,0,0,2.2392298435619735,2.0789975429157423,EXOSC10
GO_Biological_Process_2021,positive regulation of B cell receptor signaling pathway (GO:0050861),1/7,0.3951684614757873,0.999987999384392,0,0,2.2392298435619735,2.0789975429157423,PRKCH
GO_Biological_Process_2021,positive regulation of cAMP-mediated signaling (GO:0043950),1/7,0.3951684614757873,0.999987999384392,0,0,2.2392298435619735,2.0789975429157423,CGAS
GO_Biological_Process_2021,positive regulation of chemokine (C-X-C motif) ligand 2 production (GO:2000343),1/7,0.3951684614757873,0.999987999384392,0,0,2.2392298435619735,2.0789975429157423,CD74
GO_Biological_Process_2021,positive regulation of fibroblast apoptotic process (GO:2000271),1/7,0.3951684614757873,0.999987999384392,0,0,2.2392298435619735,2.0789975429157423,SFRP1
GO_Biological_Process_2021,positive regulation of gliogenesis (GO:0014015),1/7,0.3951684614757873,0.999987999384392,0,0,2.2392298435619735,2.0789975429157423,PRKCH
GO_Biological_Process_2021,positive regulation of histone H3-K9 methylation (GO:0051574),1/7,0.3951684614757873,0.999987999384392,0,0,2.2392298435619735,2.0789975429157423,MYB
GO_Biological_Process_2021,positive regulation of integrin-mediated signaling pathway (GO:2001046),1/7,0.3951684614757873,0.999987999384392,0,0,2.2392298435619735,2.0789975429157423,CD63
GO_Biological_Process_2021,positive regulation of lamellipodium morphogenesis (GO:2000394),1/7,0.3951684614757873,0.999987999384392,0,0,2.2392298435619735,2.0789975429157423,VIL1
GO_Biological_Process_2021,positive regulation of microtubule nucleation (GO:0090063),1/7,0.3951684614757873,0.999987999384392,0,0,2.2392298435619735,2.0789975429157423,DCTN1
GO_Biological_Process_2021,positive regulation of multicellular organism growth (GO:0040018),1/7,0.3951684614757873,0.999987999384392,0,0,2.2392298435619735,2.0789975429157423,GHR
GO_Biological_Process_2021,positive regulation of phospholipid biosynthetic process (GO:0071073),1/7,0.3951684614757873,0.999987999384392,0,0,2.2392298435619735,2.0789975429157423,HTR2A
GO_Biological_Process_2021,positive regulation of pinocytosis (GO:0048549),1/7,0.3951684614757873,0.999987999384392,0,0,2.2392298435619735,2.0789975429157423,PPT1
GO_Biological_Process_2021,positive regulation of podosome assembly (GO:0071803),1/7,0.3951684614757873,0.999987999384392,0,0,2.2392298435619735,2.0789975429157423,LCP1
GO_Biological_Process_2021,positive regulation of potassium ion import across plasma membrane (GO:1903288),1/7,0.3951684614757873,0.999987999384392,0,0,2.2392298435619735,2.0789975429157423,ATP1B1
GO_Biological_Process_2021,positive regulation of RNA polymerase II transcription preinitiation complex assembly (GO:0045899),1/7,0.3951684614757873,0.999987999384392,0,0,2.2392298435619735,2.0789975429157423,PSMC3
GO_Biological_Process_2021,positive regulation of striated muscle contraction (GO:0045989),1/7,0.3951684614757873,0.999987999384392,0,0,2.2392298435619735,2.0789975429157423,RGS2
GO_Biological_Process_2021,positive regulation of unsaturated fatty acid biosynthetic process (GO:2001280),1/7,0.3951684614757873,0.999987999384392,0,0,2.2392298435619735,2.0789975429157423,CD74
GO_Biological_Process_2021,"posttranslational protein targeting to membrane, translocation (GO:0031204)",1/7,0.3951684614757873,0.999987999384392,0,0,2.2392298435619735,2.0789975429157423,SEC62
GO_Biological_Process_2021,protection from non-homologous end joining at telomere (GO:0031848),1/7,0.3951684614757873,0.999987999384392,0,0,2.2392298435619735,2.0789975429157423,TERF2IP
GO_Biological_Process_2021,receptor-mediated endocytosis of virus by host cell (GO:0019065),1/7,0.3951684614757873,0.999987999384392,0,0,2.2392298435619735,2.0789975429157423,SIGLEC1
GO_Biological_Process_2021,regulation of bone remodeling (GO:0046850),1/7,0.3951684614757873,0.999987999384392,0,0,2.2392298435619735,2.0789975429157423,SFRP1
GO_Biological_Process_2021,"regulation of CD8-positive, alpha-beta T cell differentiation (GO:0043376)",1/7,0.3951684614757873,0.999987999384392,0,0,2.2392298435619735,2.0789975429157423,NCKAP1L
GO_Biological_Process_2021,regulation of cGMP-mediated signaling (GO:0010752),1/7,0.3951684614757873,0.999987999384392,0,0,2.2392298435619735,2.0789975429157423,CGAS
GO_Biological_Process_2021,regulation of endothelial cell chemotaxis to fibroblast growth factor (GO:2000544),1/7,0.3951684614757873,0.999987999384392,0,0,2.2392298435619735,2.0789975429157423,FGF1
GO_Biological_Process_2021,regulation of glial cell apoptotic process (GO:0034350),1/7,0.3951684614757873,0.999987999384392,0,0,2.2392298435619735,2.0789975429157423,PRKCH
GO_Biological_Process_2021,regulation of I-kappaB phosphorylation (GO:1903719),1/7,0.3951684614757873,0.999987999384392,0,0,2.2392298435619735,2.0789975429157423,DDRGK1
GO_Biological_Process_2021,regulation of MDA-5 signaling pathway (GO:0039533),1/7,0.3951684614757873,0.999987999384392,0,0,2.2392298435619735,2.0789975429157423,DHX58
GO_Biological_Process_2021,regulation of myosin-light-chain-phosphatase activity (GO:0035507),1/7,0.3951684614757873,0.999987999384392,0,0,2.2392298435619735,2.0789975429157423,NCKAP1L
GO_Biological_Process_2021,regulation of necrotic cell death (GO:0010939),1/7,0.3951684614757873,0.999987999384392,0,0,2.2392298435619735,2.0789975429157423,HEBP2
GO_Biological_Process_2021,regulation of oxidative stress-induced neuron intrinsic apoptotic signaling pathway (GO:1903376),1/7,0.3951684614757873,0.999987999384392,0,0,2.2392298435619735,2.0789975429157423,NONO
GO_Biological_Process_2021,regulation of prostaglandin biosynthetic process (GO:0031392),1/7,0.3951684614757873,0.999987999384392,0,0,2.2392298435619735,2.0789975429157423,CD74
GO_Biological_Process_2021,regulation of striated muscle cell differentiation (GO:0051153),1/7,0.3951684614757873,0.999987999384392,0,0,2.2392298435619735,2.0789975429157423,HDAC5
GO_Biological_Process_2021,regulation of T cell mediated immune response to tumor cell (GO:0002840),1/7,0.3951684614757873,0.999987999384392,0,0,2.2392298435619735,2.0789975429157423,IL4I1
GO_Biological_Process_2021,regulation of tubulin deacetylation (GO:0090043),1/7,0.3951684614757873,0.999987999384392,0,0,2.2392298435619735,2.0789975429157423,BEX4
GO_Biological_Process_2021,release of sequestered calcium ion into cytosol by endoplasmic reticulum (GO:1903514),1/7,0.3951684614757873,0.999987999384392,0,0,2.2392298435619735,2.0789975429157423,RYR1
GO_Biological_Process_2021,response to alkaloid (GO:0043279),1/7,0.3951684614757873,0.999987999384392,0,0,2.2392298435619735,2.0789975429157423,RYR1
GO_Biological_Process_2021,response to caffeine (GO:0031000),1/7,0.3951684614757873,0.999987999384392,0,0,2.2392298435619735,2.0789975429157423,RYR1
GO_Biological_Process_2021,RIG-I signaling pathway (GO:0039529),1/7,0.3951684614757873,0.999987999384392,0,0,2.2392298435619735,2.0789975429157423,OAS3
GO_Biological_Process_2021,skin morphogenesis (GO:0043589),1/7,0.3951684614757873,0.999987999384392,0,0,2.2392298435619735,2.0789975429157423,ITGA6
GO_Biological_Process_2021,smooth muscle cell migration (GO:0014909),1/7,0.3951684614757873,0.999987999384392,0,0,2.2392298435619735,2.0789975429157423,CCN3
GO_Biological_Process_2021,sphingosine-1-phosphate receptor signaling pathway (GO:0003376),1/7,0.3951684614757873,0.999987999384392,0,0,2.2392298435619735,2.0789975429157423,RAC1
GO_Biological_Process_2021,succinate transport (GO:0015744),1/7,0.3951684614757873,0.999987999384392,0,0,2.2392298435619735,2.0789975429157423,SLC25A10
GO_Biological_Process_2021,synaptic vesicle budding from presynaptic endocytic zone membrane (GO:0016185),1/7,0.3951684614757873,0.999987999384392,0,0,2.2392298435619735,2.0789975429157423,DNM1
GO_Biological_Process_2021,synaptic vesicle docking (GO:0016081),1/7,0.3951684614757873,0.999987999384392,0,0,2.2392298435619735,2.0789975429157423,STX1B
GO_Biological_Process_2021,thiamine-containing compound metabolic process (GO:0042723),1/7,0.3951684614757873,0.999987999384392,0,0,2.2392298435619735,2.0789975429157423,SLC19A3
GO_Biological_Process_2021,TRAIL-activated apoptotic signaling pathway (GO:0036462),1/7,0.3951684614757873,0.999987999384392,0,0,2.2392298435619735,2.0789975429157423,SPI1
GO_Biological_Process_2021,vitamin A metabolic process (GO:0006776),1/7,0.3951684614757873,0.999987999384392,0,0,2.2392298435619735,2.0789975429157423,RBP1
GO_Biological_Process_2021,xenobiotic catabolic process (GO:0042178),1/7,0.3951684614757873,0.999987999384392,0,0,2.2392298435619735,2.0789975429157423,GSTM3
GO_Biological_Process_2021,regulation of B cell proliferation (GO:0030888),4/46,0.3962326796304348,0.999987999384392,0,0,1.2798566604644752,1.184831994685598,VAV3;CD74;BST1;NCKAP1L
GO_Biological_Process_2021,regulation of double-strand break repair via homologous recombination (GO:0010569),4/46,0.3962326796304348,0.999987999384392,0,0,1.2798566604644752,1.184831994685598,RAD51AP1;PARPBP;CGAS;TERF2IP
GO_Biological_Process_2021,epithelial cell differentiation (GO:0030855),8/101,0.4010849216376256,0.999987999384392,0,0,1.1561714811866972,1.0562575690943126,VIL1;GSTK1;UPK1B;TAGLN;CASP6;CDHR2;ASCL1;DNPH1
GO_Biological_Process_2021,cellular amide metabolic process (GO:0043603),9/115,0.4029359864577524,0.999987999384392,0,0,1.1412011345418671,1.037326236655039,PM20D1;DHFR2;ST6GAL1;CPXM2;ACOT11;PCCB;ACOT1;ACOT4;ATF4
GO_Biological_Process_2021,actin filament bundle organization (GO:0061572),3/33,0.4032159898890566,0.999987999384392,0,0,1.3437454808387563,1.220501049653726,CALD1;LCP1;RFLNA
GO_Biological_Process_2021,apoptotic mitochondrial changes (GO:0008637),3/33,0.4032159898890566,0.999987999384392,0,0,1.3437454808387563,1.220501049653726,DNM1L;CLU;HK2
GO_Biological_Process_2021,positive regulation of histone modification (GO:0031058),3/33,0.4032159898890566,0.999987999384392,0,0,1.3437454808387563,1.220501049653726,AKAP8L;BRD7;GLYR1
GO_Biological_Process_2021,monocarboxylic acid metabolic process (GO:0032787),11/143,0.405146843772405,0.999987999384392,0,0,1.120121212121212,1.0120359002624897,LDHC;PDHX;MECR;PDHA1;ACOT11;CYP1A2;PCCB;ACOT1;ABAT;AOAH;ACOT4
GO_Biological_Process_2021,protein-DNA complex assembly (GO:0065004),11/143,0.405146843772405,0.999987999384392,0,0,1.120121212121212,1.0120359002624897,DDB1;DAXX;PSMB4;PSMD7;PSMB2;PSMC3;ORC3;UBC;XPC;PSMA7;RBX1
GO_Biological_Process_2021,"DNA damage response, signal transduction by p53 class mediator (GO:0030330)",6/74,0.4072881181518361,0.999987999384392,0,0,1.1858056265984656,1.0651314493760409,PIDD1;PLK3;GADD45A;RPS27L;FOXM1;AURKA
GO_Biological_Process_2021,NIK/NF-kappaB signaling (GO:0038061),6/74,0.4072881181518361,0.999987999384392,0,0,1.1858056265984656,1.0651314493760409,PSMB4;PSMD7;PSMB2;PSMC3;PSMA7;SKP1
GO_Biological_Process_2021,"base-excision repair, AP site formation (GO:0006285)",2/20,0.4081482442183476,0.999987999384392,0,0,1.4929351316634554,1.3378562364331732,NTHL1;TERF2IP
GO_Biological_Process_2021,cellular response to nitrogen compound (GO:1901699),2/20,0.4081482442183476,0.999987999384392,0,0,1.4929351316634554,1.3378562364331732,DAXX;DDX11
GO_Biological_Process_2021,cortical actin cytoskeleton organization (GO:0030866),2/20,0.4081482442183476,0.999987999384392,0,0,1.4929351316634554,1.3378562364331732,NCKAP1L;LCP1
GO_Biological_Process_2021,granulocyte differentiation (GO:0030851),2/20,0.4081482442183476,0.999987999384392,0,0,1.4929351316634554,1.3378562364331732,SPI1;SRP54
GO_Biological_Process_2021,positive regulation of epidermal cell differentiation (GO:0045606),2/20,0.4081482442183476,0.999987999384392,0,0,1.4929351316634554,1.3378562364331732,PRKCH;ETV4
GO_Biological_Process_2021,positive regulation of hormone secretion (GO:0046887),2/20,0.4081482442183476,0.999987999384392,0,0,1.4929351316634554,1.3378562364331732,NMB;CYP19A1
GO_Biological_Process_2021,positive regulation of peptidyl-lysine acetylation (GO:2000758),2/20,0.4081482442183476,0.999987999384392,0,0,1.4929351316634554,1.3378562364331732,BRD7;GLYR1
GO_Biological_Process_2021,post-transcriptional gene silencing by RNA (GO:0035194),2/20,0.4081482442183476,0.999987999384392,0,0,1.4929351316634554,1.3378562364331732,LIMD1;WTIP
GO_Biological_Process_2021,protein targeting to lysosome (GO:0006622),2/20,0.4081482442183476,0.999987999384392,0,0,1.4929351316634554,1.3378562364331732,M6PR;CLU
GO_Biological_Process_2021,protein-DNA complex disassembly (GO:0032986),2/20,0.4081482442183476,0.999987999384392,0,0,1.4929351316634554,1.3378562364331732,SMARCD1;SUPT16H
GO_Biological_Process_2021,regulation of hippo signaling (GO:0035330),2/20,0.4081482442183476,0.999987999384392,0,0,1.4929351316634554,1.3378562364331732,LIMD1;WTIP
GO_Biological_Process_2021,regulation of programmed necrotic cell death (GO:0062098),2/20,0.4081482442183476,0.999987999384392,0,0,1.4929351316634554,1.3378562364331732,CDC37;NUPR1
GO_Biological_Process_2021,regulation of protein modification by small protein conjugation or removal (GO:1903320),2/20,0.4081482442183476,0.999987999384392,0,0,1.4929351316634554,1.3378562364331732,DAXX;EPAS1
GO_Biological_Process_2021,negative regulation of binding (GO:0051100),7/88,0.4100169400033333,0.999987999384392,0,0,1.1614338534812307,1.0354842533707485,GOLGA2;CYP2D6;DDX11;IFIT1;GTF2F1;TTBK1;AURKA
GO_Biological_Process_2021,histone deacetylation (GO:0016575),4/47,0.4122115987615593,0.999987999384392,0,0,1.2500252414767947,1.1077954597721678,HDAC5;MORF4L1;SIN3B;TBL1X
GO_Biological_Process_2021,regulation of wound healing (GO:0061041),4/47,0.4122115987615593,0.999987999384392,0,0,1.2500252414767947,1.1077954597721678,VIL1;DUOX1;CLDN4;SERPINE1
GO_Biological_Process_2021,collagen fibril organization (GO:0030199),7/89,0.4215632955585116,0.999987999384392,0,0,1.1472081218274113,0.9909415637762928,COL18A1;COL6A2;COL4A3;COL6A1;COL9A1;LOXL4;ITGA6
