Gene_set,Term,Overlap,P-value,Adjusted P-value,Old P-value,Old Adjusted P-value,Odds Ratio,Combined Score,Genes
GO_Biological_Process_2021,protein K48-linked ubiquitination (GO:0070936),3/57,0.8515862448250634,0.999995545160402,0,0,0.6287831995058678,0.1010168494233578,ZNRF1;UBE2D4;KLHL3
GO_Biological_Process_2021,regulation of bone mineralization (GO:0030500),3/57,0.8515862448250634,0.999995545160402,0,0,0.6287831995058678,0.1010168494233578,ACVR1;OSR1;TWIST1
GO_Biological_Process_2021,ribosomal large subunit biogenesis (GO:0042273),3/57,0.8515862448250634,0.999995545160402,0,0,0.6287831995058678,0.1010168494233578,RPF2;RPL3L;RPF1
GO_Biological_Process_2021,positive regulation of protein-containing complex assembly (GO:0031334),7/118,0.8521829654444459,0.999995545160402,0,0,0.7132959584971968,0.1140945610284735,CDH5;FSCN1;DAB2IP;ASAP1;SKAP1;TTBK1;ATR
GO_Biological_Process_2021,endoplasmic reticulum organization (GO:0007029),4/73,0.8533070722383014,0.999995545160402,0,0,0.6559896813027355,0.1040634514084795,SMPD4;DOP1B;STX5;MOSPD3
GO_Biological_Process_2021,ubiquitin-dependent ERAD pathway (GO:0030433),4/73,0.8533070722383014,0.999995545160402,0,0,0.6559896813027355,0.1040634514084795,FBXO27;UBXN8;MAN1A1;AUP1
GO_Biological_Process_2021,inorganic cation transmembrane transport (GO:0098662),18/274,0.8547625577407687,0.999995545160402,0,0,0.7943909756857855,0.1246650141576719,KCNG1;KCNK6;MCOLN3;SLC6A17;TRPC3;ABCC8;KCNC3;SLC30A5;SLC39A11;KCNJ16;SLC30A10;SLC6A20;PKD2;TRPC4AP;TMEM175;SLC8A3;KCNQ4;RHCG
GO_Biological_Process_2021,hexose metabolic process (GO:0019318),2/41,0.8562267561642978,0.999995545160402,0,0,0.5805318138651472,0.0901101689658188,PMM2;FBP2
GO_Biological_Process_2021,import into cell (GO:0098657),2/41,0.8562267561642978,0.999995545160402,0,0,0.5805318138651472,0.0901101689658188,LRSAM1;SLC6A20
GO_Biological_Process_2021,nucleobase-containing compound catabolic process (GO:0034655),2/41,0.8562267561642978,0.999995545160402,0,0,0.5805318138651472,0.0901101689658188,ENTPD2;ADPRM
GO_Biological_Process_2021,positive regulation of biomineral tissue development (GO:0070169),2/41,0.8562267561642978,0.999995545160402,0,0,0.5805318138651472,0.0901101689658188,ACVR1;OSR1
GO_Biological_Process_2021,positive regulation of TOR signaling (GO:0032008),2/41,0.8562267561642978,0.999995545160402,0,0,0.5805318138651472,0.0901101689658188,HDAC3;CLEC16A
GO_Biological_Process_2021,protein methylation (GO:0006479),2/41,0.8562267561642978,0.999995545160402,0,0,0.5805318138651472,0.0901101689658188,METTL22;CARM1
GO_Biological_Process_2021,regulation of cell development (GO:0060284),2/41,0.8562267561642978,0.999995545160402,0,0,0.5805318138651472,0.0901101689658188,PER2;FOXO1
GO_Biological_Process_2021,regulation of mitochondrial membrane potential (GO:0051881),2/41,0.8562267561642978,0.999995545160402,0,0,0.5805318138651472,0.0901101689658188,PID1;BCL2
GO_Biological_Process_2021,response to growth factor (GO:0070848),2/41,0.8562267561642978,0.999995545160402,0,0,0.5805318138651472,0.0901101689658188,ACVR1;STAT5B
GO_Biological_Process_2021,steroid metabolic process (GO:0008202),6/104,0.8571372408600286,0.999995545160402,0,0,0.6925641543746212,0.1067637731445676,STS;DHRS11;CYP4V2;UGT2B15;CYP1A2;CYP7B1
GO_Biological_Process_2021,acylglycerol biosynthetic process (GO:0046463),1/23,0.8572131525346538,0.999995545160402,0,0,0.5147215523526443,0.0793024659690573,PNPLA3
GO_Biological_Process_2021,artery development (GO:0060840),1/23,0.8572131525346538,0.999995545160402,0,0,0.5147215523526443,0.0793024659690573,PKD2
GO_Biological_Process_2021,cytoskeleton-dependent intracellular transport (GO:0030705),1/23,0.8572131525346538,0.999995545160402,0,0,0.5147215523526443,0.0793024659690573,MYO10
GO_Biological_Process_2021,"DNA catabolic process, endonucleolytic (GO:0000737)",1/23,0.8572131525346538,0.999995545160402,0,0,0.5147215523526443,0.0793024659690573,MUS81
GO_Biological_Process_2021,drug catabolic process (GO:0042737),1/23,0.8572131525346538,0.999995545160402,0,0,0.5147215523526443,0.0793024659690573,CYP1A2
GO_Biological_Process_2021,hexose transmembrane transport (GO:0008645),1/23,0.8572131525346538,0.999995545160402,0,0,0.5147215523526443,0.0793024659690573,SLC2A9
GO_Biological_Process_2021,membrane protein ectodomain proteolysis (GO:0006509),1/23,0.8572131525346538,0.999995545160402,0,0,0.5147215523526443,0.0793024659690573,HM13
GO_Biological_Process_2021,mitotic cell cycle checkpoint signaling (GO:0007093),1/23,0.8572131525346538,0.999995545160402,0,0,0.5147215523526443,0.0793024659690573,PLK3
GO_Biological_Process_2021,negative regulation of reactive oxygen species metabolic process (GO:2000378),1/23,0.8572131525346538,0.999995545160402,0,0,0.5147215523526443,0.0793024659690573,SLC30A10
GO_Biological_Process_2021,nucleotide metabolic process (GO:0009117),1/23,0.8572131525346538,0.999995545160402,0,0,0.5147215523526443,0.0793024659690573,PNP
GO_Biological_Process_2021,"nucleotide-excision repair, DNA damage recognition (GO:0000715)",1/23,0.8572131525346538,0.999995545160402,0,0,0.5147215523526443,0.0793024659690573,XPC
GO_Biological_Process_2021,oligosaccharide biosynthetic process (GO:0009312),1/23,0.8572131525346538,0.999995545160402,0,0,0.5147215523526443,0.0793024659690573,ST3GAL3
GO_Biological_Process_2021,positive regulation of cell cycle G2/M phase transition (GO:1902751),1/23,0.8572131525346538,0.999995545160402,0,0,0.5147215523526443,0.0793024659690573,MECP2
GO_Biological_Process_2021,positive regulation of histone acetylation (GO:0035066),1/23,0.8572131525346538,0.999995545160402,0,0,0.5147215523526443,0.0793024659690573,SMARCB1
GO_Biological_Process_2021,positive regulation of natural killer cell mediated immunity (GO:0002717),1/23,0.8572131525346538,0.999995545160402,0,0,0.5147215523526443,0.0793024659690573,PVR
GO_Biological_Process_2021,protein alkylation (GO:0008213),1/23,0.8572131525346538,0.999995545160402,0,0,0.5147215523526443,0.0793024659690573,METTL22
GO_Biological_Process_2021,regulation of mononuclear cell migration (GO:0071675),1/23,0.8572131525346538,0.999995545160402,0,0,0.5147215523526443,0.0793024659690573,STK10
GO_Biological_Process_2021,regulation of necroptotic process (GO:0060544),1/23,0.8572131525346538,0.999995545160402,0,0,0.5147215523526443,0.0793024659690573,CFLAR
GO_Biological_Process_2021,regulation of SMAD protein signal transduction (GO:0060390),1/23,0.8572131525346538,0.999995545160402,0,0,0.5147215523526443,0.0793024659690573,KIAA0319
GO_Biological_Process_2021,regulation of supramolecular fiber organization (GO:1902903),1/23,0.8572131525346538,0.999995545160402,0,0,0.5147215523526443,0.0793024659690573,APOE
GO_Biological_Process_2021,regulation of toll-like receptor 4 signaling pathway (GO:0034143),1/23,0.8572131525346538,0.999995545160402,0,0,0.5147215523526443,0.0793024659690573,DAB2IP
GO_Biological_Process_2021,post-Golgi vesicle-mediated transport (GO:0006892),5/89,0.8576662801863295,0.999995545160402,0,0,0.6734252142415408,0.103397846111454,DOP1B;GBF1;COMMD1;CCDC22;KLHL20
GO_Biological_Process_2021,regulation of endothelial cell migration (GO:0010594),5/89,0.8576662801863295,0.999995545160402,0,0,0.6734252142415408,0.103397846111454,APOH;DAB2IP;VASH1;APOE;FGF1
GO_Biological_Process_2021,positive regulation of developmental process (GO:0051094),11/177,0.8586474505478914,0.999995545160402,0,0,0.7491119038537764,0.1141623017087537,ACVR1;DLG5;ZNF703;AGO2;DAB2IP;APOE;PA2G4;PHLDB2;ANAPC2;SHANK1;MARCHF5
GO_Biological_Process_2021,cellular iron ion homeostasis (GO:0006879),3/58,0.8597116645654838,0.999995545160402,0,0,0.6173170868661912,0.0933125518487768,FLVCR1;ATP6V0A2;ACO1
GO_Biological_Process_2021,mitochondrial respiratory chain complex I assembly (GO:0032981),3/58,0.8597116645654838,0.999995545160402,0,0,0.6173170868661912,0.0933125518487768,NDUFAF6;NDUFAF1;ECSIT
GO_Biological_Process_2021,NADH dehydrogenase complex assembly (GO:0010257),3/58,0.8597116645654838,0.999995545160402,0,0,0.6173170868661912,0.0933125518487768,NDUFAF6;NDUFAF1;ECSIT
GO_Biological_Process_2021,negative regulation of hydrolase activity (GO:0051346),3/58,0.8597116645654838,0.999995545160402,0,0,0.6173170868661912,0.0933125518487768,PPP1R35;DAB2IP;F11R
GO_Biological_Process_2021,regulation of calcium ion transport (GO:0051924),3/58,0.8597116645654838,0.999995545160402,0,0,0.6173170868661912,0.0933125518487768,BCL2;IL16;PKD2
GO_Biological_Process_2021,regulation of tumor necrosis factor-mediated signaling pathway (GO:0010803),3/58,0.8597116645654838,0.999995545160402,0,0,0.6173170868661912,0.0933125518487768,CLIP3;SHARPIN;CFLAR
GO_Biological_Process_2021,RNA modification (GO:0009451),3/58,0.8597116645654838,0.999995545160402,0,0,0.6173170868661912,0.0933125518487768,NSUN4;TFB1M;TRDMT1
GO_Biological_Process_2021,MAPK cascade (GO:0000165),20/303,0.8604009537382145,0.999995545160402,0,0,0.7982513024796742,0.1200224899691645,BRAP;SPTBN4;SHC3;RASGRF1;DAB2IP;TGFA;FGF1;GFRA2;SPTB;DUSP6;PPP5C;KITLG;SPRED1;FNTA;PTPRA;ABHD17A;HSF1;FGF18;RALGDS;MEN1
GO_Biological_Process_2021,proteolysis involved in cellular protein catabolic process (GO:0051603),4/74,0.8605280516957367,0.999995545160402,0,0,0.6465830831714638,0.097122640086165,HM13;RHBDD1;CAPN2;ADAMTS12
GO_Biological_Process_2021,regulation of stress fiber assembly (GO:0051492),4/74,0.8605280516957367,0.999995545160402,0,0,0.6465830831714638,0.097122640086165,LIMK1;ALMS1;F11R;PHLDB2
GO_Biological_Process_2021,regulation of inflammatory response (GO:0050727),13/206,0.861637313037316,0.999995545160402,0,0,0.7612780441622093,0.1133701714402584,DAGLA;PRKCD;IL16;AOAH;ADAMTS12;METRNL;SELE;CDH5;IL1RL2;SHARPIN;BCL6;TYRO3;APOE
GO_Biological_Process_2021,mitochondrial translation (GO:0032543),6/105,0.863179499053329,0.999995545160402,0,0,0.6855310531053105,0.1008639766842745,LARS2;MRPS21;QRSL1;MRRF;EARS2;DAP3
GO_Biological_Process_2021,positive regulation of cellular metabolic process (GO:0031325),6/105,0.863179499053329,0.999995545160402,0,0,0.6855310531053105,0.1008639766842745,PID1;WNT3A;WNT7A;APOE;ARRB2;SELE
GO_Biological_Process_2021,double-strand break repair (GO:0006302),10/164,0.8649425461051917,0.999995545160402,0,0,0.734104605072347,0.1065128484683342,RNF168;SMARCAL1;MMS22L;PPP5C;RAD50;POLM;LIG3;BRCC3;TENT4A;FAN1
GO_Biological_Process_2021,ATP-dependent chromatin remodeling (GO:0043044),2/42,0.8653794722600328,0.999995545160402,0,0,0.5659876543209876,0.0818345543223284,SMARCB1;CHD4
GO_Biological_Process_2021,ceramide biosynthetic process (GO:0046513),2/42,0.8653794722600328,0.999995545160402,0,0,0.5659876543209876,0.0818345543223284,SMPD4;B4GALNT1
GO_Biological_Process_2021,determination of left/right symmetry (GO:0007368),2/42,0.8653794722600328,0.999995545160402,0,0,0.5659876543209876,0.0818345543223284,PKD1L1;PKD2
GO_Biological_Process_2021,histone H3 acetylation (GO:0043966),2/42,0.8653794722600328,0.999995545160402,0,0,0.5659876543209876,0.0818345543223284,TAF12;JADE2
GO_Biological_Process_2021,negative regulation of protein catabolic process (GO:0042177),2/42,0.8653794722600328,0.999995545160402,0,0,0.5659876543209876,0.0818345543223284,DAB2IP;FLNA
GO_Biological_Process_2021,positive regulation of ATPase activity (GO:0032781),2/42,0.8653794722600328,0.999995545160402,0,0,0.5659876543209876,0.0818345543223284,RGN;DNAJC24
GO_Biological_Process_2021,positive regulation of protein tyrosine kinase activity (GO:0061098),2/42,0.8653794722600328,0.999995545160402,0,0,0.5659876543209876,0.0818345543223284,TGFA;NOX4
GO_Biological_Process_2021,potassium ion import across plasma membrane (GO:1990573),2/42,0.8653794722600328,0.999995545160402,0,0,0.5659876543209876,0.0818345543223284,KCNJ6;KCNJ16
GO_Biological_Process_2021,regulation of chemokine production (GO:0032642),2/42,0.8653794722600328,0.999995545160402,0,0,0.5659876543209876,0.0818345543223284,SIGIRR;EGR1
GO_Biological_Process_2021,regulation of double-strand break repair (GO:2000779),2/42,0.8653794722600328,0.999995545160402,0,0,0.5659876543209876,0.0818345543223284,DDX11;TWIST1
GO_Biological_Process_2021,response to cytokine (GO:0034097),9/150,0.8671933689279514,0.999995545160402,0,0,0.7216762738916516,0.1028340300872411,SIGIRR;IGBP1;IL1RL2;PID1;KHSRP;BCL2;PTPN9;SELE;KLHL20
GO_Biological_Process_2021,nucleic acid phosphodiester bond hydrolysis (GO:0090305),4/75,0.8674430199805301,0.999995545160402,0,0,0.6374414596354393,0.0906476511063943,MUS81;POLD3;RAD50;FAN1
GO_Biological_Process_2021,positive regulation of immune response (GO:0050778),4/75,0.8674430199805301,0.999995545160402,0,0,0.6374414596354393,0.0906476511063943,POLR3D;ADAM8;SLC15A4;SKAP1
GO_Biological_Process_2021,positive regulation of lymphocyte proliferation (GO:0050671),4/75,0.8674430199805301,0.999995545160402,0,0,0.6374414596354393,0.0906476511063943,PNP;BCL2;CD38;EPHB2
GO_Biological_Process_2021,mitotic DNA damage checkpoint signaling (GO:0044773),3/59,0.8674440513650048,0.999995545160402,0,0,0.6062604782493602,0.0862128247044544,MUS81;BRCC3;FBXO31
GO_Biological_Process_2021,positive regulation of apoptotic signaling pathway (GO:2001235),3/59,0.8674440513650048,0.999995545160402,0,0,0.6062604782493602,0.0862128247044544,DAB2IP;BCL2;STYXL1
GO_Biological_Process_2021,carbohydrate biosynthetic process (GO:0016051),1/24,0.8688063617746021,0.999995545160402,0,0,0.4923155325483464,0.0692367985358448,ST3GAL3
GO_Biological_Process_2021,cardiac muscle cell development (GO:0055013),1/24,0.8688063617746021,0.999995545160402,0,0,0.4923155325483464,0.0692367985358448,FHOD3
GO_Biological_Process_2021,cellular response to catecholamine stimulus (GO:0071870),1/24,0.8688063617746021,0.999995545160402,0,0,0.4923155325483464,0.0692367985358448,NR4A3
GO_Biological_Process_2021,DNA packaging (GO:0006323),1/24,0.8688063617746021,0.999995545160402,0,0,0.4923155325483464,0.0692367985358448,H1-4
GO_Biological_Process_2021,extracellular matrix assembly (GO:0085029),1/24,0.8688063617746021,0.999995545160402,0,0,0.4923155325483464,0.0692367985358448,QSOX1
GO_Biological_Process_2021,heterochromatin assembly (GO:0031507),1/24,0.8688063617746021,0.999995545160402,0,0,0.4923155325483464,0.0692367985358448,NRDE2
GO_Biological_Process_2021,inner ear morphogenesis (GO:0042472),1/24,0.8688063617746021,0.999995545160402,0,0,0.4923155325483464,0.0692367985358448,EPHB2
GO_Biological_Process_2021,leukotriene metabolic process (GO:0006691),1/24,0.8688063617746021,0.999995545160402,0,0,0.4923155325483464,0.0692367985358448,LTC4S
GO_Biological_Process_2021,negative regulation of neuron differentiation (GO:0045665),1/24,0.8688063617746021,0.999995545160402,0,0,0.4923155325483464,0.0692367985358448,DTX1
GO_Biological_Process_2021,negative regulation of ossification (GO:0030279),1/24,0.8688063617746021,0.999995545160402,0,0,0.4923155325483464,0.0692367985358448,CHSY1
GO_Biological_Process_2021,negative regulation of synaptic transmission (GO:0050805),1/24,0.8688063617746021,0.999995545160402,0,0,0.4923155325483464,0.0692367985358448,PNKD
GO_Biological_Process_2021,porphyrin-containing compound biosynthetic process (GO:0006779),1/24,0.8688063617746021,0.999995545160402,0,0,0.4923155325483464,0.0692367985358448,FLVCR1
GO_Biological_Process_2021,positive regulation of carbohydrate metabolic process (GO:0045913),1/24,0.8688063617746021,0.999995545160402,0,0,0.4923155325483464,0.0692367985358448,PFKFB3
GO_Biological_Process_2021,positive regulation of cellular response to transforming growth factor beta stimulus (GO:1903846),1/24,0.8688063617746021,0.999995545160402,0,0,0.4923155325483464,0.0692367985358448,MEN1
GO_Biological_Process_2021,positive regulation of lamellipodium assembly (GO:0010592),1/24,0.8688063617746021,0.999995545160402,0,0,0.4923155325483464,0.0692367985358448,FSCN1
GO_Biological_Process_2021,positive regulation of transforming growth factor beta receptor signaling pathway (GO:0030511),1/24,0.8688063617746021,0.999995545160402,0,0,0.4923155325483464,0.0692367985358448,MEN1
GO_Biological_Process_2021,positive regulation of viral life cycle (GO:1903902),1/24,0.8688063617746021,0.999995545160402,0,0,0.4923155325483464,0.0692367985358448,TYRO3
GO_Biological_Process_2021,"protein alpha-1,2-demannosylation (GO:0036508)",1/24,0.8688063617746021,0.999995545160402,0,0,0.4923155325483464,0.0692367985358448,MAN1A1
GO_Biological_Process_2021,protein insertion into mitochondrial membrane (GO:0051204),1/24,0.8688063617746021,0.999995545160402,0,0,0.4923155325483464,0.0692367985358448,TIMM29
GO_Biological_Process_2021,protein K48-linked deubiquitination (GO:0071108),1/24,0.8688063617746021,0.999995545160402,0,0,0.4923155325483464,0.0692367985358448,OTUD3
GO_Biological_Process_2021,regulation of keratinocyte proliferation (GO:0010837),1/24,0.8688063617746021,0.999995545160402,0,0,0.4923155325483464,0.0692367985358448,EPB41L4B
GO_Biological_Process_2021,regulation of monooxygenase activity (GO:0032768),1/24,0.8688063617746021,0.999995545160402,0,0,0.4923155325483464,0.0692367985358448,DDAH2
GO_Biological_Process_2021,regulation of ruffle assembly (GO:1900027),1/24,0.8688063617746021,0.999995545160402,0,0,0.4923155325483464,0.0692367985358448,PLEKHM1
GO_Biological_Process_2021,regulation of vascular endothelial growth factor receptor signaling pathway (GO:0030947),1/24,0.8688063617746021,0.999995545160402,0,0,0.4923155325483464,0.0692367985358448,DAB2IP
GO_Biological_Process_2021,protein localization to nucleus (GO:0034504),6/106,0.8690085386844599,0.999995545160402,0,0,0.6786386138613861,0.0952824411829086,NUP214;POM121C;NOL8;PRICKLE1;RPF2;GBP2
GO_Biological_Process_2021,cellular calcium ion homeostasis (GO:0006874),8/136,0.8702813253273485,0.999995545160402,0,0,0.7067069392812887,0.0981889838191337,SLC8A3;CDH5;TRPC3;WBP2NL;BCL2;RGN;DRD4;HCRTR2
GO_Biological_Process_2021,positive regulation of transport (GO:0051050),5/91,0.8703457144491439,0.999995545160402,0,0,0.6576922523766378,0.0913302855505795,CLIP3;CD151;CAPN10;DOC2B;APOE
GO_Biological_Process_2021,regulation of actin cytoskeleton organization (GO:0032956),5/91,0.8703457144491439,0.999995545160402,0,0,0.6576922523766378,0.0913302855505795,PRKCD;FSCN1;F11R;RND3;RHOBTB2
GO_Biological_Process_2021,sensory perception of sound (GO:0007605),5/91,0.8703457144491439,0.999995545160402,0,0,0.6576922523766378,0.0913302855505795,SPTBN4;DCDC2;LHFPL4;CRYM;PDZD7
GO_Biological_Process_2021,anion transport (GO:0006820),2/43,0.8739943732527489,0.999995545160402,0,0,0.5521529659741042,0.0743647020453909,SLC17A6;LRRC8B
GO_Biological_Process_2021,cellular response to glucose starvation (GO:0042149),2/43,0.8739943732527489,0.999995545160402,0,0,0.5521529659741042,0.0743647020453909,IFI16;KPTN
GO_Biological_Process_2021,lipid modification (GO:0030258),2/43,0.8739943732527489,0.999995545160402,0,0,0.5521529659741042,0.0743647020453909,DGKD;EPHX2
GO_Biological_Process_2021,positive regulation of axonogenesis (GO:0050772),2/43,0.8739943732527489,0.999995545160402,0,0,0.5521529659741042,0.0743647020453909,LIMK1;NGF
GO_Biological_Process_2021,positive regulation of phospholipase C activity (GO:0010863),2/43,0.8739943732527489,0.999995545160402,0,0,0.5521529659741042,0.0743647020453909,ADRA1A;SELE
GO_Biological_Process_2021,establishment of protein localization to organelle (GO:0072594),4/76,0.8740611873767432,0.999995545160402,0,0,0.6285537700865266,0.0846064156931985,NUP214;LRSAM1;POM121C;PRICKLE1
GO_Biological_Process_2021,regulation of cell division (GO:0051302),4/76,0.8740611873767432,0.999995545160402,0,0,0.6285537700865266,0.0846064156931985,PLK3;SMYD5;PRDM15;FGF1
GO_Biological_Process_2021,regulation of MAPK cascade (GO:0043408),10/166,0.8742353265475712,0.999995545160402,0,0,0.7246134758541707,0.0973921721952188,IL11;SPRED1;WWC1;PRDM15;APIP;DAB2IP;PTPRJ;ADRA1B;ADRA1A;TMEM106A
GO_Biological_Process_2021,mitotic cell cycle phase transition (GO:0044772),13/209,0.8742712269020325,0.999995545160402,0,0,0.7495021625803833,0.1007065756666425,ACVR1;TRIM71;PLK3;KDM8;HAUS1;PCM1;SPAST;CNTRL;ENSA;ALMS1;EIF4EBP1;CEP250;MAPRE1
GO_Biological_Process_2021,epithelium development (GO:0060429),7/122,0.8744511360590717,0.999995545160402,0,0,0.6883349037555526,0.0923462277192371,TRIM71;EHF;OSR1;PTCH1;RHCG;PKD2;MFSD2A
GO_Biological_Process_2021,adenylate cyclase-inhibiting G protein-coupled receptor signaling pathway (GO:0007193),3/60,0.8747979322697768,0.999995545160402,0,0,0.5955918208120672,0.0796677638813639,ADCY3;FLNA;DRD4
GO_Biological_Process_2021,regulation of peptidyl-tyrosine phosphorylation (GO:0050730),5/92,0.876318802937636,0.999995545160402,0,0,0.6500970294073742,0.0858292709117769,ACVR1;IL11;PRKCD;PTPRJ;TNFRSF14
GO_Biological_Process_2021,actin filament organization (GO:0007015),9/152,0.8767483416006566,0.999995545160402,0,0,0.7115048621558231,0.0935879923280961,FHOD3;SAMD14;HIP1;TPM4;TPM3;MYO5C;FLNA;RND3;RHOBTB2
GO_Biological_Process_2021,negative regulation of apoptotic process (GO:0043066),33/485,0.8768549706334211,0.999995545160402,0,0,0.823635391546974,0.1082369496639466,FANK1;HDAC3;BCL2A1;APIP;FHL2;SLC30A10;FSTL1;FOXO1;SH3RF1;MAEA;GRK5;APOH;MYO18A;FLNA;CD38;BNIP2;APOE;IGBP1;PLK3;KDM2B;OSR1;RHBDD1;PRKCD;SERPINB9;PA2G4;CFLAR;NGF;KLHL20;DDAH2;TYRO3;BCL2;UBE2O;ADAM8
GO_Biological_Process_2021,regulation of ERK1 and ERK2 cascade (GO:0070372),15/238,0.8770655568341089,0.999995545160402,0,0,0.7599180714419259,0.099681142148485,DUSP4;PTPRR;DAB2IP;APIP;ARRB2;SLC30A10;ADRA1A;DUSP6;SPRED3;ADCYAP1;SPRED2;SPRED1;WNK2;APOE;EPHB2
GO_Biological_Process_2021,transmembrane receptor protein tyrosine kinase signaling pathway (GO:0007169),27/404,0.8776565431893032,0.999995545160402,0,0,0.8082735338383377,0.1054796498970975,SHC4;TRIM71;SHC3;PTPRJ;FGF1;FOXO1;EFNB1;SPRED2;SPRED1;UBASH3B;NAMPT;ATP6V0A2;SH2D6;EPHB2;ATP6V1E2;SH2B2;TIE1;NGF;GFRA2;NR4A3;COL4A2;HNRNPF;ESRP1;FGF18;TYRO3;RAPGEF1;ATP6V0D2
GO_Biological_Process_2021,3'-phosphoadenosine 5'-phosphosulfate metabolic process (GO:0050427),1/25,0.8794588095851509,0.999995545160402,0,0,0.4717766810610734,0.0605990305122412,PAPSS2
GO_Biological_Process_2021,cardiac conduction system development (GO:0003161),1/25,0.8794588095851509,0.999995545160402,0,0,0.4717766810610734,0.0605990305122412,MAML1
GO_Biological_Process_2021,cellular response to hexose stimulus (GO:0071331),1/25,0.8794588095851509,0.999995545160402,0,0,0.4717766810610734,0.0605990305122412,ERN1
GO_Biological_Process_2021,fat-soluble vitamin metabolic process (GO:0006775),1/25,0.8794588095851509,0.999995545160402,0,0,0.4717766810610734,0.0605990305122412,UBIAD1
GO_Biological_Process_2021,in utero embryonic development (GO:0001701),1/25,0.8794588095851509,0.999995545160402,0,0,0.4717766810610734,0.0605990305122412,PTPRR
GO_Biological_Process_2021,negative regulation of cell junction assembly (GO:1901889),1/25,0.8794588095851509,0.999995545160402,0,0,0.4717766810610734,0.0605990305122412,PHLDB2
GO_Biological_Process_2021,negative regulation of ion transport (GO:0043271),1/25,0.8794588095851509,0.999995545160402,0,0,0.4717766810610734,0.0605990305122412,WNK2
GO_Biological_Process_2021,negative regulation of response to endoplasmic reticulum stress (GO:1903573),1/25,0.8794588095851509,0.999995545160402,0,0,0.4717766810610734,0.0605990305122412,CREB3L1
GO_Biological_Process_2021,peripheral nervous system development (GO:0007422),1/25,0.8794588095851509,0.999995545160402,0,0,0.4717766810610734,0.0605990305122412,NGF
GO_Biological_Process_2021,phosphatidylinositol dephosphorylation (GO:0046856),1/25,0.8794588095851509,0.999995545160402,0,0,0.4717766810610734,0.0605990305122412,SYNJ2
GO_Biological_Process_2021,"positive regulation of DNA-templated transcription, elongation (GO:0032786)",1/25,0.8794588095851509,0.999995545160402,0,0,0.4717766810610734,0.0605990305122412,EAPP
GO_Biological_Process_2021,positive regulation of lipid metabolic process (GO:0045834),1/25,0.8794588095851509,0.999995545160402,0,0,0.4717766810610734,0.0605990305122412,APOE
GO_Biological_Process_2021,positive regulation of T cell migration (GO:2000406),1/25,0.8794588095851509,0.999995545160402,0,0,0.4717766810610734,0.0605990305122412,TNFRSF14
GO_Biological_Process_2021,protein quality control for misfolded or incompletely synthesized proteins (GO:0006515),1/25,0.8794588095851509,0.999995545160402,0,0,0.4717766810610734,0.0605990305122412,AUP1
GO_Biological_Process_2021,regulation of calcium ion import (GO:0090279),1/25,0.8794588095851509,0.999995545160402,0,0,0.4717766810610734,0.0605990305122412,PKD2
GO_Biological_Process_2021,regulation of cAMP-mediated signaling (GO:0043949),1/25,0.8794588095851509,0.999995545160402,0,0,0.4717766810610734,0.0605990305122412,PDE3A
GO_Biological_Process_2021,regulation of cardiac muscle cell action potential (GO:0098901),1/25,0.8794588095851509,0.999995545160402,0,0,0.4717766810610734,0.0605990305122412,DSG2
GO_Biological_Process_2021,regulation of dopamine secretion (GO:0014059),1/25,0.8794588095851509,0.999995545160402,0,0,0.4717766810610734,0.0605990305122412,SYT12
GO_Biological_Process_2021,regulation of heterotypic cell-cell adhesion (GO:0034114),1/25,0.8794588095851509,0.999995545160402,0,0,0.4717766810610734,0.0605990305122412,SKAP1
GO_Biological_Process_2021,regulation of interferon-alpha production (GO:0032647),1/25,0.8794588095851509,0.999995545160402,0,0,0.4717766810610734,0.0605990305122412,PTPRS
GO_Biological_Process_2021,regulation of mitochondrial fission (GO:0090140),1/25,0.8794588095851509,0.999995545160402,0,0,0.4717766810610734,0.0605990305122412,MARCHF5
GO_Biological_Process_2021,regulation of proteolysis involved in cellular protein catabolic process (GO:1903050),1/25,0.8794588095851509,0.999995545160402,0,0,0.4717766810610734,0.0605990305122412,APOE
GO_Biological_Process_2021,regulation of ryanodine-sensitive calcium-release channel activity (GO:0060314),1/25,0.8794588095851509,0.999995545160402,0,0,0.4717766810610734,0.0605990305122412,PKD2
GO_Biological_Process_2021,response to dsRNA (GO:0043331),1/25,0.8794588095851509,0.999995545160402,0,0,0.4717766810610734,0.0605990305122412,SLC3A2
