Gene_set,Term,Overlap,P-value,Adjusted P-value,Old P-value,Old Adjusted P-value,Odds Ratio,Combined Score,Genes
GO_Biological_Process_2021,regulation of viral release from host cell (GO:1902186),1/22,0.7942015252184421,0.999987999384392,0,0,0.639264225545814,0.1472980097904484,DDB1
GO_Biological_Process_2021,rRNA methylation (GO:0031167),1/22,0.7942015252184421,0.999987999384392,0,0,0.639264225545814,0.1472980097904484,BUD23
GO_Biological_Process_2021,ubiquitin-dependent protein catabolic process via the multivesicular body sorting pathway (GO:0043162),1/22,0.7942015252184421,0.999987999384392,0,0,0.639264225545814,0.1472980097904484,VPS25
GO_Biological_Process_2021,Notch signaling pathway (GO:0007219),3/60,0.7949644309697562,0.999987999384392,0,0,0.7062069490428892,0.1620447679046436,TRAF7;SNW1;ASCL1
GO_Biological_Process_2021,ribonucleoprotein complex biogenesis (GO:0022613),3/60,0.7949644309697562,0.999987999384392,0,0,0.7062069490428892,0.1620447679046436,NOP14;SURF6;RPF2
GO_Biological_Process_2021,negative regulation of immune response (GO:0050777),10/178,0.7964264133869821,0.999987999384392,0,0,0.7979478128460686,0.1816293131381946,GPR39;HCK;SPI1;P2RY11;TRAF3IP1;HRH2;DHX58;GPR83;PRKACA;CRHR2
GO_Biological_Process_2021,regulation of mitotic cell cycle (GO:0007346),10/178,0.7964264133869821,0.999987999384392,0,0,0.7979478128460686,0.1816293131381946,DDB1;PSMB4;PSMD7;ANAPC15;PSMB2;PSMC3;XPC;KIF20B;PSMA7;SKP1
GO_Biological_Process_2021,negative regulation of blood vessel morphogenesis (GO:2000181),4/78,0.7980357970637753,0.999987999384392,0,0,0.7251535182070638,0.1635959564328752,SARS1;NAXE;COL4A3;ISM1
GO_Biological_Process_2021,ATP-dependent chromatin remodeling (GO:0043044),2/42,0.7981581306284611,0.999987999384392,0,0,0.6710260115606936,0.1512818362731196,RNF8;ANP32E
GO_Biological_Process_2021,calcium ion transmembrane import into cytosol (GO:0097553),2/42,0.7981581306284611,0.999987999384392,0,0,0.6710260115606936,0.1512818362731196,RYR1;HTR2A
GO_Biological_Process_2021,negative regulation of protein catabolic process (GO:0042177),2/42,0.7981581306284611,0.999987999384392,0,0,0.6710260115606936,0.1512818362731196,ATRAID;RILP
GO_Biological_Process_2021,positive regulation of ATPase activity (GO:0032781),2/42,0.7981581306284611,0.999987999384392,0,0,0.6710260115606936,0.1512818362731196,TPM1;ATP1B1
GO_Biological_Process_2021,potassium ion import across plasma membrane (GO:1990573),2/42,0.7981581306284611,0.999987999384392,0,0,0.6710260115606936,0.1512818362731196,KCNE2;ATP1B1
GO_Biological_Process_2021,regulation of chemokine production (GO:0032642),2/42,0.7981581306284611,0.999987999384392,0,0,0.6710260115606936,0.1512818362731196,SIGIRR;CD74
GO_Biological_Process_2021,regulation of ubiquitin-dependent protein catabolic process (GO:2000058),2/42,0.7981581306284611,0.999987999384392,0,0,0.6710260115606936,0.1512818362731196,GLMN;CLU
GO_Biological_Process_2021,ubiquitin-dependent protein catabolic process (GO:0006511),21/354,0.8006052349765695,0.999987999384392,0,0,0.8445830445830446,0.1878245375292933,ANAPC15;ADRM1;RNF8;CBLC;UBE2L6;PSMA7;RBX1;AURKA;DDB1;RMND5B;NSFL1C;UCHL1;PSMB4;PSMD7;PSMB2;PSMC3;ARIH2;UFD1;RBCK1;TBL1X;UBL7
GO_Biological_Process_2021,regulation of mRNA stability (GO:0043488),8/146,0.800873479837743,0.999987999384392,0,0,0.7772659388738142,0.1725936872245462,PSMB4;PSMD7;PSMB2;PSMC3;METTL3;DND1;UBC;PSMA7
GO_Biological_Process_2021,"nuclear-transcribed mRNA catabolic process, nonsense-mediated decay (GO:0000184)",6/113,0.8034024260306253,0.999987999384392,0,0,0.7520113774888256,0.164614942619487,RPL4;RBM8A;RPLP1;UPF3B;UPF3A;RPL28
GO_Biological_Process_2021,cellular transition metal ion homeostasis (GO:0046916),5/96,0.8035451338694025,0.999987999384392,0,0,0.7369639773694806,0.1611901788986562,ARF1;SCARA5;FTH1;ATOX1;SKP1
GO_Biological_Process_2021,recombinational repair (GO:0000725),4/79,0.8060744854661712,0.999987999384392,0,0,0.7154462132175591,0.1542352700720964,RAD51AP1;MORF4L1;SLX4;XRCC1
GO_Biological_Process_2021,diacylglycerol metabolic process (GO:0046339),1/23,0.8084789586690503,0.999987999384392,0,0,0.6101739415818839,0.1297233616136863,DGKD
GO_Biological_Process_2021,membrane protein ectodomain proteolysis (GO:0006509),1/23,0.8084789586690503,0.999987999384392,0,0,0.6101739415818839,0.1297233616136863,ADAM19
GO_Biological_Process_2021,negative regulation of GTPase activity (GO:0034260),1/23,0.8084789586690503,0.999987999384392,0,0,0.6101739415818839,0.1297233616136863,GMIP
GO_Biological_Process_2021,negative regulation of intracellular protein transport (GO:0090317),1/23,0.8084789586690503,0.999987999384392,0,0,0.6101739415818839,0.1297233616136863,APOD
GO_Biological_Process_2021,nucleotide metabolic process (GO:0009117),1/23,0.8084789586690503,0.999987999384392,0,0,0.6101739415818839,0.1297233616136863,NMNAT3
GO_Biological_Process_2021,peptidyl-L-cysteine S-palmitoylation (GO:0018230),1/23,0.8084789586690503,0.999987999384392,0,0,0.6101739415818839,0.1297233616136863,ZDHHC4
GO_Biological_Process_2021,peptidyl-S-diacylglycerol-L-cysteine biosynthetic process from peptidyl-cysteine (GO:0018231),1/23,0.8084789586690503,0.999987999384392,0,0,0.6101739415818839,0.1297233616136863,ZDHHC4
GO_Biological_Process_2021,positive regulation of morphogenesis of an epithelium (GO:1905332),1/23,0.8084789586690503,0.999987999384392,0,0,0.6101739415818839,0.1297233616136863,NOG
GO_Biological_Process_2021,positive regulation of protein autophosphorylation (GO:0031954),1/23,0.8084789586690503,0.999987999384392,0,0,0.6101739415818839,0.1297233616136863,CALM1
GO_Biological_Process_2021,positive regulation of transcription initiation from RNA polymerase II promoter (GO:0060261),1/23,0.8084789586690503,0.999987999384392,0,0,0.6101739415818839,0.1297233616136863,PSMC3
GO_Biological_Process_2021,regulation of B cell receptor signaling pathway (GO:0050855),1/23,0.8084789586690503,0.999987999384392,0,0,0.6101739415818839,0.1297233616136863,PRKCH
GO_Biological_Process_2021,regulation of calcium ion transmembrane transport (GO:1903169),1/23,0.8084789586690503,0.999987999384392,0,0,0.6101739415818839,0.1297233616136863,CACNB1
GO_Biological_Process_2021,regulation of cysteine-type endopeptidase activity (GO:2000116),1/23,0.8084789586690503,0.999987999384392,0,0,0.6101739415818839,0.1297233616136863,TTBK1
GO_Biological_Process_2021,regulation of interleukin-4 production (GO:0032673),1/23,0.8084789586690503,0.999987999384392,0,0,0.6101739415818839,0.1297233616136863,NLRP3
GO_Biological_Process_2021,regulation of mononuclear cell migration (GO:0071675),1/23,0.8084789586690503,0.999987999384392,0,0,0.6101739415818839,0.1297233616136863,STK10
GO_Biological_Process_2021,regulation of necroptotic process (GO:0060544),1/23,0.8084789586690503,0.999987999384392,0,0,0.6101739415818839,0.1297233616136863,CDC37
GO_Biological_Process_2021,regulation of neural precursor cell proliferation (GO:2000177),1/23,0.8084789586690503,0.999987999384392,0,0,0.6101739415818839,0.1297233616136863,SHCBP1
GO_Biological_Process_2021,regulation of peptidase activity (GO:0052547),1/23,0.8084789586690503,0.999987999384392,0,0,0.6101739415818839,0.1297233616136863,SVBP
GO_Biological_Process_2021,regulation of steroid metabolic process (GO:0019218),1/23,0.8084789586690503,0.999987999384392,0,0,0.6101739415818839,0.1297233616136863,GNB3
GO_Biological_Process_2021,response to copper ion (GO:0046688),1/23,0.8084789586690503,0.999987999384392,0,0,0.6101739415818839,0.1297233616136863,DAXX
GO_Biological_Process_2021,response to nutrient levels (GO:0031667),1/23,0.8084789586690503,0.999987999384392,0,0,0.6101739415818839,0.1297233616136863,ATF4
GO_Biological_Process_2021,cellular glucose homeostasis (GO:0001678),2/43,0.8087769420113764,0.999987999384392,0,0,0.6546242774566474,0.1389322985814069,PRKACA;HK2
GO_Biological_Process_2021,DNA synthesis involved in DNA repair (GO:0000731),2/43,0.8087769420113764,0.999987999384392,0,0,0.6546242774566474,0.1389322985814069,UBC;UBE2L6
GO_Biological_Process_2021,positive regulation of leukocyte mediated cytotoxicity (GO:0001912),2/43,0.8087769420113764,0.999987999384392,0,0,0.6546242774566474,0.1389322985814069,AZGP1;SPI1
GO_Biological_Process_2021,positive regulation of phospholipase C activity (GO:0010863),2/43,0.8087769420113764,0.999987999384392,0,0,0.6546242774566474,0.1389322985814069,TXK;HTR2A
GO_Biological_Process_2021,positive regulation of T cell differentiation (GO:0045582),2/43,0.8087769420113764,0.999987999384392,0,0,0.6546242774566474,0.1389322985814069,IL4I1;NCKAP1L
GO_Biological_Process_2021,substantia nigra development (GO:0021762),2/43,0.8087769420113764,0.999987999384392,0,0,0.6546242774566474,0.1389322985814069,CALM1;TTBK1
GO_Biological_Process_2021,negative regulation of cell motility (GO:2000146),6/114,0.810062171417657,0.999987999384392,0,0,0.7450080515297907,0.1569316841799738,CD74;SFRP1;SERPINE1;TPM1;NOG;SINHCAF
GO_Biological_Process_2021,positive regulation of cellular component organization (GO:0051130),6/114,0.810062171417657,0.999987999384392,0,0,0.7450080515297907,0.1569316841799738,PPP1R15A;DCTN1;CLU;SHANK3;WARS1;TRABD2A
GO_Biological_Process_2021,double-strand break repair via homologous recombination (GO:0000724),5/97,0.8107207010695374,0.999987999384392,0,0,0.7289141453892894,0.1529492742400464,RAD51AP1;MORF4L1;SLX4;XRCC1;REC8
GO_Biological_Process_2021,positive regulation of cold-induced thermogenesis (GO:0120162),5/97,0.8107207010695374,0.999987999384392,0,0,0.7289141453892894,0.1529492742400464,THRA;FABP5;EPAS1;GNAS;GPR3
GO_Biological_Process_2021,regulation of MAP kinase activity (GO:0043405),5/97,0.8107207010695374,0.999987999384392,0,0,0.7289141453892894,0.1529492742400464,RGS2;UCHL1;SPRY4;CBLC;FGF1
GO_Biological_Process_2021,positive regulation of cysteine-type endopeptidase activity (GO:2001056),3/62,0.812916137707919,0.999987999384392,0,0,0.6821941983161146,0.1413010603866284,PDCD5;NLRP3;TTBK1
GO_Biological_Process_2021,negative regulation of cell cycle (GO:0045786),4/80,0.8138508000215218,0.999987999384392,0,0,0.705994363622515,0.1454194638573882,TSPYL2;TAF6;NUPR1;INHA
GO_Biological_Process_2021,positive regulation of protein metabolic process (GO:0051247),6/115,0.8165440525011717,0.999987999384392,0,0,0.7381332269644995,0.1496007200985278,DDB1;SLC6A9;LDB1;ASB9;CLU;RILP
GO_Biological_Process_2021,negative regulation of neuron death (GO:1901215),5/98,0.817685592025134,0.999987999384392,0,0,0.7210374280753389,0.1451285230297764,PM20D1;NTRK1;CDK5;PPT1;ATF4
GO_Biological_Process_2021,regulation of neuron apoptotic process (GO:0043523),5/98,0.817685592025134,0.999987999384392,0,0,0.7210374280753389,0.1451285230297764,NTRK1;CDK5;PPT1;NUPR1;ATF4
GO_Biological_Process_2021,regulation of intracellular signal transduction (GO:1902531),26/437,0.8178667731155581,0.999987999384392,0,0,0.8467117503935881,0.1702363292550743,MEAF6;RASGRF2;FGF1;ARHGAP15;RPF2;AURKA;ARHGAP22;PIDD1;STK11;TMSB4X;PAK6;RAC1;BRD7;TAF9B;NTRK1;VAV3;TPTE2;PLK3;DAXX;SUPT16H;GMIP;WDR54;BST1;OBSCN;CDK5;TAF6
GO_Biological_Process_2021,cardiac ventricle morphogenesis (GO:0003208),2/44,0.8188946424647453,0.999987999384392,0,0,0.6390035783099367,0.1276728159540034,NPY5R;TPM1
GO_Biological_Process_2021,cation transmembrane transport (GO:0098655),2/44,0.8188946424647453,0.999987999384392,0,0,0.6390035783099367,0.1276728159540034,SLC6A9;ATP1B1
GO_Biological_Process_2021,intracellular steroid hormone receptor signaling pathway (GO:0030518),2/44,0.8188946424647453,0.999987999384392,0,0,0.6390035783099367,0.1276728159540034,DAXX;SAFB
GO_Biological_Process_2021,positive regulation of cell-matrix adhesion (GO:0001954),2/44,0.8188946424647453,0.999987999384392,0,0,0.6390035783099367,0.1276728159540034,SFRP1;RAC1
GO_Biological_Process_2021,positive regulation of osteoblast differentiation (GO:0045669),2/44,0.8188946424647453,0.999987999384392,0,0,0.6390035783099367,0.1276728159540034,WNT7B;ATRAID
GO_Biological_Process_2021,regulation of endothelial cell apoptotic process (GO:2000351),2/44,0.8188946424647453,0.999987999384392,0,0,0.6390035783099367,0.1276728159540034,IL11;SERPINE1
GO_Biological_Process_2021,activation of cysteine-type endopeptidase activity involved in apoptotic process (GO:0006919),4/81,0.8213695662475884,0.999987999384392,0,0,0.6967880166143553,0.1371154295246075,PIDD1;COL4A3;RPS27L;NLRP1
GO_Biological_Process_2021,amyloid fibril formation (GO:1990000),3/63,0.8213814742349733,0.999987999384392,0,0,0.6707881417208966,0.1319893939543045,UBC;UBE2L6;B2M
GO_Biological_Process_2021,regulation of cell cycle (GO:0051726),17/296,0.8216281865622939,0.999987999384392,0,0,0.8160601752580828,0.1603291507280697,TSPYL2;PPP1R15A;BEX2;GADD45A;METTL3;PPP2R3B;FOXM1;RRP8;SFRP1;STK11;CDK5;TAF6;NUPR1;PRKACA;KIF20B;INHA;CDKN3
GO_Biological_Process_2021,amino acid import across plasma membrane (GO:0089718),1/24,0.8217665392160206,0.999987999384392,0,0,0.5836132475278606,0.1145626617536334,SLC6A9
GO_Biological_Process_2021,axon extension (GO:0048675),1/24,0.8217665392160206,0.999987999384392,0,0,0.5836132475278606,0.1145626617536334,CDK5
GO_Biological_Process_2021,C21-steroid hormone metabolic process (GO:0008207),1/24,0.8217665392160206,0.999987999384392,0,0,0.5836132475278606,0.1145626617536334,HSD17B10
GO_Biological_Process_2021,canonical glycolysis (GO:0061621),1/24,0.8217665392160206,0.999987999384392,0,0,0.5836132475278606,0.1145626617536334,HK2
GO_Biological_Process_2021,extracellular matrix assembly (GO:0085029),1/24,0.8217665392160206,0.999987999384392,0,0,0.5836132475278606,0.1145626617536334,TNXB
GO_Biological_Process_2021,glucose catabolic process to pyruvate (GO:0061718),1/24,0.8217665392160206,0.999987999384392,0,0,0.5836132475278606,0.1145626617536334,HK2
GO_Biological_Process_2021,heterochromatin assembly (GO:0031507),1/24,0.8217665392160206,0.999987999384392,0,0,0.5836132475278606,0.1145626617536334,RRP8
GO_Biological_Process_2021,immune response-activating cell surface receptor signaling pathway (GO:0002429),1/24,0.8217665392160206,0.999987999384392,0,0,0.5836132475278606,0.1145626617536334,SH2B2
GO_Biological_Process_2021,inner ear morphogenesis (GO:0042472),1/24,0.8217665392160206,0.999987999384392,0,0,0.5836132475278606,0.1145626617536334,TMIE
GO_Biological_Process_2021,iron-sulfur cluster assembly (GO:0016226),1/24,0.8217665392160206,0.999987999384392,0,0,0.5836132475278606,0.1145626617536334,NDOR1
GO_Biological_Process_2021,mammary gland development (GO:0030879),1/24,0.8217665392160206,0.999987999384392,0,0,0.5836132475278606,0.1145626617536334,WNT7B
GO_Biological_Process_2021,ncRNA 3'-end processing (GO:0043628),1/24,0.8217665392160206,0.999987999384392,0,0,0.5836132475278606,0.1145626617536334,INTS5
GO_Biological_Process_2021,negative regulation of lipid metabolic process (GO:0045833),1/24,0.8217665392160206,0.999987999384392,0,0,0.5836132475278606,0.1145626617536334,APOD
GO_Biological_Process_2021,negative regulation of ossification (GO:0030279),1/24,0.8217665392160206,0.999987999384392,0,0,0.5836132475278606,0.1145626617536334,SFRP1
GO_Biological_Process_2021,negative regulation of protein depolymerization (GO:1901880),1/24,0.8217665392160206,0.999987999384392,0,0,0.5836132475278606,0.1145626617536334,PLEKHH2
GO_Biological_Process_2021,negative regulation of stress fiber assembly (GO:0051497),1/24,0.8217665392160206,0.999987999384392,0,0,0.5836132475278606,0.1145626617536334,STMN1
GO_Biological_Process_2021,"nucleotide-binding domain, leucine rich repeat containing receptor signaling pathway (GO:0035872)",1/24,0.8217665392160206,0.999987999384392,0,0,0.5836132475278606,0.1145626617536334,UBC
GO_Biological_Process_2021,positive regulation of lamellipodium assembly (GO:0010592),1/24,0.8217665392160206,0.999987999384392,0,0,0.5836132475278606,0.1145626617536334,RAC1
GO_Biological_Process_2021,positive regulation of protein targeting to membrane (GO:0090314),1/24,0.8217665392160206,0.999987999384392,0,0,0.5836132475278606,0.1145626617536334,CEMIP
GO_Biological_Process_2021,potassium ion homeostasis (GO:0055075),1/24,0.8217665392160206,0.999987999384392,0,0,0.5836132475278606,0.1145626617536334,ATP1B1
GO_Biological_Process_2021,"protein alpha-1,2-demannosylation (GO:0036508)",1/24,0.8217665392160206,0.999987999384392,0,0,0.5836132475278606,0.1145626617536334,UBC
GO_Biological_Process_2021,protein exit from endoplasmic reticulum (GO:0032527),1/24,0.8217665392160206,0.999987999384392,0,0,0.5836132475278606,0.1145626617536334,UFD1
GO_Biological_Process_2021,protein kinase B signaling (GO:0043491),1/24,0.8217665392160206,0.999987999384392,0,0,0.5836132475278606,0.1145626617536334,PLK3
GO_Biological_Process_2021,purine ribonucleotide catabolic process (GO:0009154),1/24,0.8217665392160206,0.999987999384392,0,0,0.5836132475278606,0.1145626617536334,NUDT16
GO_Biological_Process_2021,regulation of cardiac muscle hypertrophy (GO:0010611),1/24,0.8217665392160206,0.999987999384392,0,0,0.5836132475278606,0.1145626617536334,RGS2
GO_Biological_Process_2021,cytosolic transport (GO:0016482),6/116,0.8228502806277923,0.999987999384392,0,0,0.7313833992094861,0.1426058767253899,GAK;DCTN1;STX16;DOP1B;VPS53;RILP
GO_Biological_Process_2021,ion transport (GO:0006811),6/116,0.8228502806277923,0.999987999384392,0,0,0.7313833992094861,0.1426058767253899,ANO1;SLC9A8;VDAC2;CNGA3;SLC25A10;SLC1A7
GO_Biological_Process_2021,defense response to virus (GO:0051607),7/133,0.8228634630132952,0.999987999384392,0,0,0.7448231407622271,0.1452144388954401,STING1;APOBEC3H;OAS3;CGAS;NLRP1;IFIT1;RNASE1
GO_Biological_Process_2021,post-translational protein modification (GO:0043687),20/345,0.8264797173820199,0.999987999384392,0,0,0.8239216127942336,0.1570229005472993,EPAS1;SDC2;DSCC1;SUMF2;PSMA7;CKAP4;DDA1;F5;RBX1;DDB1;FBXO40;PSMB4;COPS6;PSMD7;PSMB2;PSMC3;ASB9;SCG3;SKP1;UBE2M
GO_Biological_Process_2021,positive regulation of chemotaxis (GO:0050921),2/45,0.8285296299598828,0.999987999384392,0,0,0.6241094233095846,0.1173966547480645,TMSB4X;STX4
GO_Biological_Process_2021,positive regulation of Notch signaling pathway (GO:0045747),2/45,0.8285296299598828,0.999987999384392,0,0,0.6241094233095846,0.1173966547480645,SNW1;CCN3
GO_Biological_Process_2021,regulation of DNA repair (GO:0006282),2/45,0.8285296299598828,0.999987999384392,0,0,0.6241094233095846,0.1173966547480645,ABRAXAS1;RNF8
GO_Biological_Process_2021,regulation of pri-miRNA transcription by RNA polymerase II (GO:1902893),2/45,0.8285296299598828,0.999987999384392,0,0,0.6241094233095846,0.1173966547480645,SPI1;ETS1
GO_Biological_Process_2021,positive regulation of peptidyl-tyrosine phosphorylation (GO:0050731),7/134,0.8286220104309372,0.999987999384392,0,0,0.7389184219992806,0.1389101507264423,TNFSF18;GHR;IL11;CD74;TEC;IL31RA;CD44
GO_Biological_Process_2021,protein catabolic process (GO:0030163),3/64,0.8295178806562429,0.999987999384392,0,0,0.6597560541943743,0.1233154089415991,DDB1;PPT1;PRPF19
GO_Biological_Process_2021,protein polyubiquitination (GO:0000209),18/314,0.8295717411904956,0.999987999384392,0,0,0.814278093883357,0.1521443489009857,RNF8;UBE2L6;PRPF19;PSMA7;DDA1;RBX1;DCAF15;FBXO40;PSMB4;PSMD7;PSMB2;PSMC3;RUSC1;UBC;ARIH2;RBCK1;UNKL;SKP1
GO_Biological_Process_2021,endoplasmic reticulum to Golgi vesicle-mediated transport (GO:0006888),10/185,0.8327222965918339,0.999987999384392,0,0,0.7657392026578073,0.140172443220742,GOLGA2;F8;TRAPPC2L;KDELR1;DCTN1;TRAPPC4;COPG2;CNIH3;COPE;F5
GO_Biological_Process_2021,3'-phosphoadenosine 5'-phosphosulfate metabolic process (GO:0050427),1/25,0.8341328471513587,0.999987999384392,0,0,0.559265944645006,0.101429925900778,PAPSS2
GO_Biological_Process_2021,cellular response to hexose stimulus (GO:0071331),1/25,0.8341328471513587,0.999987999384392,0,0,0.559265944645006,0.101429925900778,PRKACA
GO_Biological_Process_2021,fat-soluble vitamin metabolic process (GO:0006775),1/25,0.8341328471513587,0.999987999384392,0,0,0.559265944645006,0.101429925900778,RBP1
GO_Biological_Process_2021,glycolytic process through glucose-6-phosphate (GO:0061620),1/25,0.8341328471513587,0.999987999384392,0,0,0.559265944645006,0.101429925900778,HK2
GO_Biological_Process_2021,in utero embryonic development (GO:0001701),1/25,0.8341328471513587,0.999987999384392,0,0,0.559265944645006,0.101429925900778,WNT7B
GO_Biological_Process_2021,negative regulation of cell junction assembly (GO:1901889),1/25,0.8341328471513587,0.999987999384392,0,0,0.559265944645006,0.101429925900778,APOD
GO_Biological_Process_2021,negative regulation of endocytosis (GO:0045806),1/25,0.8341328471513587,0.999987999384392,0,0,0.559265944645006,0.101429925900778,RAC1
GO_Biological_Process_2021,negative regulation of response to endoplasmic reticulum stress (GO:1903573),1/25,0.8341328471513587,0.999987999384392,0,0,0.559265944645006,0.101429925900778,CLU
GO_Biological_Process_2021,negative regulation of signaling (GO:0023057),1/25,0.8341328471513587,0.999987999384392,0,0,0.559265944645006,0.101429925900778,IL11
GO_Biological_Process_2021,peptide catabolic process (GO:0043171),1/25,0.8341328471513587,0.999987999384392,0,0,0.559265944645006,0.101429925900778,CPQ
GO_Biological_Process_2021,peroxisome organization (GO:0007031),1/25,0.8341328471513587,0.999987999384392,0,0,0.559265944645006,0.101429925900778,DNM1L
GO_Biological_Process_2021,phosphatidylinositol dephosphorylation (GO:0046856),1/25,0.8341328471513587,0.999987999384392,0,0,0.559265944645006,0.101429925900778,TPTE2
GO_Biological_Process_2021,positive regulation of vascular endothelial growth factor production (GO:0010575),1/25,0.8341328471513587,0.999987999384392,0,0,0.559265944645006,0.101429925900778,ATF4
GO_Biological_Process_2021,protein quality control for misfolded or incompletely synthesized proteins (GO:0006515),1/25,0.8341328471513587,0.999987999384392,0,0,0.559265944645006,0.101429925900778,UFD1
GO_Biological_Process_2021,regulation of cAMP-mediated signaling (GO:0043949),1/25,0.8341328471513587,0.999987999384392,0,0,0.559265944645006,0.101429925900778,CGAS
GO_Biological_Process_2021,regulation of cardiac muscle cell action potential (GO:0098901),1/25,0.8341328471513587,0.999987999384392,0,0,0.559265944645006,0.101429925900778,CALM1
GO_Biological_Process_2021,regulation of cholesterol transport (GO:0032374),1/25,0.8341328471513587,0.999987999384392,0,0,0.559265944645006,0.101429925900778,NAXE
GO_Biological_Process_2021,regulation of dopamine secretion (GO:0014059),1/25,0.8341328471513587,0.999987999384392,0,0,0.559265944645006,0.101429925900778,SYT6
GO_Biological_Process_2021,regulation of proteolysis involved in cellular protein catabolic process (GO:1903050),1/25,0.8341328471513587,0.999987999384392,0,0,0.559265944645006,0.101429925900778,PRKACA
GO_Biological_Process_2021,"RNA splicing, via transesterification reactions (GO:0000375)",1/25,0.8341328471513587,0.999987999384392,0,0,0.559265944645006,0.101429925900778,PRPF6
GO_Biological_Process_2021,sodium ion homeostasis (GO:0055078),1/25,0.8341328471513587,0.999987999384392,0,0,0.559265944645006,0.101429925900778,ATP1B1
GO_Biological_Process_2021,ventricular cardiac muscle tissue development (GO:0003229),1/25,0.8341328471513587,0.999987999384392,0,0,0.559265944645006,0.101429925900778,TPM1
GO_Biological_Process_2021,regulation of Notch signaling pathway (GO:0008593),4/83,0.8356546404013462,0.999987999384392,0,0,0.6790745388265035,0.1219209481862759,SNW1;PRAG1;METTL3;CCN3
GO_Biological_Process_2021,BMP signaling pathway (GO:0030509),3/65,0.8373341044593698,0.999987999384392,0,0,0.6490798404590301,0.1152325195624257,DLX5;NOG;AMH
GO_Biological_Process_2021,cellular response to type I interferon (GO:0071357),3/65,0.8373341044593698,0.999987999384392,0,0,0.6490798404590301,0.1152325195624257,OAS3;HLA-C;IFIT1
GO_Biological_Process_2021,inorganic anion transmembrane transport (GO:0098661),3/65,0.8373341044593698,0.999987999384392,0,0,0.6490798404590301,0.1152325195624257,ANO1;SLC25A3;SLC25A10
GO_Biological_Process_2021,protein autoubiquitination (GO:0051865),3/65,0.8373341044593698,0.999987999384392,0,0,0.6490798404590301,0.1152325195624257,SH3RF2;NFX1;RNF8
GO_Biological_Process_2021,type I interferon signaling pathway (GO:0060337),3/65,0.8373341044593698,0.999987999384392,0,0,0.6490798404590301,0.1152325195624257,OAS3;HLA-C;IFIT1
GO_Biological_Process_2021,positive regulation of protein localization to membrane (GO:1905477),5/101,0.8373488606710429,0.999987999384392,0,0,0.6983918657977312,0.1239746803742171,CEMIP;PRKCH;PDCD5;NMT1;STX4
GO_Biological_Process_2021,erythrocyte differentiation (GO:0030218),2/46,0.837700161187113,0.999987999384392,0,0,0.6098922753547031,0.1080089001967814,NCKAP1L;INHA
GO_Biological_Process_2021,positive regulation of organelle assembly (GO:1902117),2/46,0.837700161187113,0.999987999384392,0,0,0.6098922753547031,0.1080089001967814,PLK4;LCP1
GO_Biological_Process_2021,positive regulation of response to stimulus (GO:0048584),2/46,0.837700161187113,0.999987999384392,0,0,0.6098922753547031,0.1080089001967814,CGAS;B2M
GO_Biological_Process_2021,postreplication repair (GO:0006301),2/46,0.837700161187113,0.999987999384392,0,0,0.6098922753547031,0.1080089001967814,UBC;UBE2L6
GO_Biological_Process_2021,posttranscriptional regulation of gene expression (GO:0010608),2/46,0.837700161187113,0.999987999384392,0,0,0.6098922753547031,0.1080089001967814,RBM3;ATG14
GO_Biological_Process_2021,negative regulation of inflammatory response to antigenic stimulus (GO:0002862),7/136,0.839695411312882,0.999987999384392,0,0,0.727383622555385,0.127085599537221,GPR39;HCK;P2RY11;HRH2;GPR83;PRKACA;CRHR2
GO_Biological_Process_2021,intrinsic apoptotic signaling pathway (GO:0097193),5/102,0.8435043622613302,0.999987999384392,0,0,0.6911546242450936,0.1176277474562806,PPP1R15A;STK11;SELENOK;RRP8;ATF4
GO_Biological_Process_2021,positive regulation of vasculature development (GO:1904018),5/102,0.8435043622613302,0.999987999384392,0,0,0.6911546242450936,0.1176277474562806,SERPINE1;ADAM12;FGF1;ETS1;HK2
