Gene_set,Term,Overlap,P-value,Adjusted P-value,Old P-value,Old Adjusted P-value,Odds Ratio,Combined Score,Genes
GO_Biological_Process_2021,polyol biosynthetic process (GO:0046173),2/16,0.3767395480107916,0.999995545160402,0,0,1.619400352733686,1.580860542302243,PPIP5K1;ACER3
GO_Biological_Process_2021,positive regulation of vasoconstriction (GO:0045907),2/16,0.3767395480107916,0.999995545160402,0,0,1.619400352733686,1.580860542302243,ADRA1B;ADRA1A
GO_Biological_Process_2021,protein localization to microtubule organizing center (GO:1905508),2/16,0.3767395480107916,0.999995545160402,0,0,1.619400352733686,1.580860542302243,PCM1;CEP83
GO_Biological_Process_2021,regulation of ATP biosynthetic process (GO:2001169),2/16,0.3767395480107916,0.999995545160402,0,0,1.619400352733686,1.580860542302243,PID1;DNAJC30
GO_Biological_Process_2021,regulation of cellular carbohydrate metabolic process (GO:0010675),2/16,0.3767395480107916,0.999995545160402,0,0,1.619400352733686,1.580860542302243,BCKDK;MLYCD
GO_Biological_Process_2021,regulation of fatty acid oxidation (GO:0046320),2/16,0.3767395480107916,0.999995545160402,0,0,1.619400352733686,1.580860542302243,NR4A3;MLYCD
GO_Biological_Process_2021,regulation of rRNA processing (GO:2000232),2/16,0.3767395480107916,0.999995545160402,0,0,1.619400352733686,1.580860542302243,USP36;BUD23
GO_Biological_Process_2021,"RNA splicing, via endonucleolytic cleavage and ligation (GO:0000394)",2/16,0.3767395480107916,0.999995545160402,0,0,1.619400352733686,1.580860542302243,ERN1;CPSF1
GO_Biological_Process_2021,RNA processing (GO:0006396),16/179,0.3800994980149283,0.999995545160402,0,0,1.1133097510103982,1.076929263962624,PIWIL2;SRRM4;DHX8;PDCD7;MAGOHB;TENT4A;SRRM1;HNRNPL;SMU1;KIN;LIN28B;PRPF18;KHSRP;HNRNPF;SRSF4;NRDE2
GO_Biological_Process_2021,positive regulation of JNK cascade (GO:0046330),7/73,0.3801973727681506,0.999995545160402,0,0,1.202589361103293,1.1629817907708908,SH3RF3;RASSF2;DAB2IP;WNT7A;MAP3K10;DUSP15;SH3RF1
GO_Biological_Process_2021,cytoskeleton organization (GO:0007010),11/120,0.381813444861899,0.999995545160402,0,0,1.1444199568334672,1.1018740322245932,ARC;SH3KBP1;MAST2;PACSIN2;APOE;CFAP410;RND3;FGD1;WASF3;RHOBTB2;KLHL20
GO_Biological_Process_2021,organic hydroxy compound biosynthetic process (GO:1901617),5/50,0.3822481553092979,0.999995545160402,0,0,1.2597402597402598,1.2114736392958174,PER2;PSAT1;OSBPL3;CYP7B1;SLC27A2
GO_Biological_Process_2021,negative regulation of defense response (GO:0031348),8/85,0.3845829348506043,0.999995545160402,0,0,1.178068523793431,1.1257573546251756,CDH5;SHARPIN;IFI16;PRKCD;TYRO3;AOAH;APOE;METRNL
GO_Biological_Process_2021,positive regulation of cold-induced thermogenesis (GO:0120162),9/97,0.3878877477470993,0.999995545160402,0,0,1.1596826917657668,1.098265074365542,PER2;ADCYAP1;HDAC3;HSF1;ALMS1;PEMT;ELOVL6;GPR3;PPARGC1B
GO_Biological_Process_2021,glucose metabolic process (GO:0006006),6/62,0.3890807303352646,0.999995545160402,0,0,1.2147719236209336,1.1467063381385998,PER2;G6PC3;PC;CRY1;ENO3;FBP2
GO_Biological_Process_2021,I-kappaB kinase/NF-kappaB signaling (GO:0007249),6/62,0.3890807303352646,0.999995545160402,0,0,1.2147719236209336,1.1467063381385998,SHARPIN;NKIRAS2;DAB2IP;TBKBP1;CD14;MAP3K14
GO_Biological_Process_2021,negative regulation of protein secretion (GO:0050709),4/39,0.3906727792170156,0.999995545160402,0,0,1.2956383542292071,1.217750991306155,MIDN;RAB11FIP1;APOE;DRD4
GO_Biological_Process_2021,negative regulation of secretion by cell (GO:1903531),4/39,0.3906727792170156,0.999995545160402,0,0,1.2956383542292071,1.217750991306155,IL11;PNKD;APOE;DRD4
GO_Biological_Process_2021,protein acylation (GO:0043543),4/39,0.3906727792170156,0.999995545160402,0,0,1.2956383542292071,1.217750991306155,ZDHHC23;ZDHHC5;ZDHHC16;FOXO1
GO_Biological_Process_2021,regulation of cellular component biogenesis (GO:0044087),4/39,0.3906727792170156,0.999995545160402,0,0,1.2956383542292071,1.217750991306155,TIE1;DAB2IP;RAPGEF1;APOE
GO_Biological_Process_2021,regulation of nitric-oxide synthase activity (GO:0050999),4/39,0.3906727792170156,0.999995545160402,0,0,1.2956383542292071,1.217750991306155,DHFR;DDAH2;APOE;GLA
GO_Biological_Process_2021,3'-phosphoadenosine 5'-phosphosulfate biosynthetic process (GO:0050428),1/6,0.3980212693076621,0.999995545160402,0,0,2.2668723010487355,2.0883557325230564,PAPSS2
GO_Biological_Process_2021,alditol metabolic process (GO:0019400),1/6,0.3980212693076621,0.999995545160402,0,0,2.2668723010487355,2.0883557325230564,GK5
GO_Biological_Process_2021,B cell chemotaxis (GO:0035754),1/6,0.3980212693076621,0.999995545160402,0,0,2.2668723010487355,2.0883557325230564,CYP7B1
GO_Biological_Process_2021,bundle of His cell-Purkinje myocyte adhesion involved in cell communication (GO:0086073),1/6,0.3980212693076621,0.999995545160402,0,0,2.2668723010487355,2.0883557325230564,DSG2
GO_Biological_Process_2021,carnitine transport (GO:0015879),1/6,0.3980212693076621,0.999995545160402,0,0,2.2668723010487355,2.0883557325230564,SLC25A29
GO_Biological_Process_2021,cellular response to bacterial lipopeptide (GO:0071221),1/6,0.3980212693076621,0.999995545160402,0,0,2.2668723010487355,2.0883557325230564,CD14
GO_Biological_Process_2021,cellular response to cold (GO:0070417),1/6,0.3980212693076621,0.999995545160402,0,0,2.2668723010487355,2.0883557325230564,FOXO1
GO_Biological_Process_2021,cellular response to lipoteichoic acid (GO:0071223),1/6,0.3980212693076621,0.999995545160402,0,0,2.2668723010487355,2.0883557325230564,CD14
GO_Biological_Process_2021,cellular response to salt (GO:1902075),1/6,0.3980212693076621,0.999995545160402,0,0,2.2668723010487355,2.0883557325230564,HSF1
GO_Biological_Process_2021,cerebral cortex cell migration (GO:0021795),1/6,0.3980212693076621,0.999995545160402,0,0,2.2668723010487355,2.0883557325230564,PEX13
GO_Biological_Process_2021,chitin catabolic process (GO:0006032),1/6,0.3980212693076621,0.999995545160402,0,0,2.2668723010487355,2.0883557325230564,OVGP1
GO_Biological_Process_2021,chitin metabolic process (GO:0006030),1/6,0.3980212693076621,0.999995545160402,0,0,2.2668723010487355,2.0883557325230564,OVGP1
GO_Biological_Process_2021,choline catabolic process (GO:0042426),1/6,0.3980212693076621,0.999995545160402,0,0,2.2668723010487355,2.0883557325230564,SARDH
GO_Biological_Process_2021,contact inhibition (GO:0060242),1/6,0.3980212693076621,0.999995545160402,0,0,2.2668723010487355,2.0883557325230564,PTPRJ
GO_Biological_Process_2021,COPI coating of Golgi vesicle (GO:0048205),1/6,0.3980212693076621,0.999995545160402,0,0,2.2668723010487355,2.0883557325230564,GBF1
GO_Biological_Process_2021,COPI-coated vesicle budding (GO:0035964),1/6,0.3980212693076621,0.999995545160402,0,0,2.2668723010487355,2.0883557325230564,GBF1
GO_Biological_Process_2021,dermatan sulfate proteoglycan metabolic process (GO:0050655),1/6,0.3980212693076621,0.999995545160402,0,0,2.2668723010487355,2.0883557325230564,CSGALNACT1
GO_Biological_Process_2021,determination of liver left/right asymmetry (GO:0071910),1/6,0.3980212693076621,0.999995545160402,0,0,2.2668723010487355,2.0883557325230564,PKD2
GO_Biological_Process_2021,double-strand break repair via classical nonhomologous end joining (GO:0097680),1/6,0.3980212693076621,0.999995545160402,0,0,2.2668723010487355,2.0883557325230564,ERCC8
GO_Biological_Process_2021,embryonic camera-type eye development (GO:0031076),1/6,0.3980212693076621,0.999995545160402,0,0,2.2668723010487355,2.0883557325230564,KDM2B
GO_Biological_Process_2021,embryonic camera-type eye morphogenesis (GO:0048596),1/6,0.3980212693076621,0.999995545160402,0,0,2.2668723010487355,2.0883557325230564,KDM2B
GO_Biological_Process_2021,embryonic skeletal joint development (GO:0072498),1/6,0.3980212693076621,0.999995545160402,0,0,2.2668723010487355,2.0883557325230564,OSR1
GO_Biological_Process_2021,endoplasmic reticulum localization (GO:0051643),1/6,0.3980212693076621,0.999995545160402,0,0,2.2668723010487355,2.0883557325230564,MOSPD3
GO_Biological_Process_2021,erythrose 4-phosphate/phosphoenolpyruvate family amino acid metabolic process (GO:1902221),1/6,0.3980212693076621,0.999995545160402,0,0,2.2668723010487355,2.0883557325230564,PAH
GO_Biological_Process_2021,galactose catabolic process (GO:0019388),1/6,0.3980212693076621,0.999995545160402,0,0,2.2668723010487355,2.0883557325230564,GALE
GO_Biological_Process_2021,GDP-mannose metabolic process (GO:0019673),1/6,0.3980212693076621,0.999995545160402,0,0,2.2668723010487355,2.0883557325230564,PMM2
GO_Biological_Process_2021,glomerular epithelial cell differentiation (GO:0072311),1/6,0.3980212693076621,0.999995545160402,0,0,2.2668723010487355,2.0883557325230564,PTPRO
GO_Biological_Process_2021,glomerulus vasculature development (GO:0072012),1/6,0.3980212693076621,0.999995545160402,0,0,2.2668723010487355,2.0883557325230564,OSR1
GO_Biological_Process_2021,glycerol-3-phosphate metabolic process (GO:0006072),1/6,0.3980212693076621,0.999995545160402,0,0,2.2668723010487355,2.0883557325230564,GK5
GO_Biological_Process_2021,glycoside metabolic process (GO:0016137),1/6,0.3980212693076621,0.999995545160402,0,0,2.2668723010487355,2.0883557325230564,GLA
GO_Biological_Process_2021,glycosyl compound catabolic process (GO:1901658),1/6,0.3980212693076621,0.999995545160402,0,0,2.2668723010487355,2.0883557325230564,GLA
GO_Biological_Process_2021,glycosylceramide catabolic process (GO:0046477),1/6,0.3980212693076621,0.999995545160402,0,0,2.2668723010487355,2.0883557325230564,GLA
GO_Biological_Process_2021,glycosylceramide metabolic process (GO:0006677),1/6,0.3980212693076621,0.999995545160402,0,0,2.2668723010487355,2.0883557325230564,GLA
GO_Biological_Process_2021,Golgi transport vesicle coating (GO:0048200),1/6,0.3980212693076621,0.999995545160402,0,0,2.2668723010487355,2.0883557325230564,GBF1
GO_Biological_Process_2021,guanine nucleotide transmembrane transport (GO:1903790),1/6,0.3980212693076621,0.999995545160402,0,0,2.2668723010487355,2.0883557325230564,SLC17A9
GO_Biological_Process_2021,"heparan sulfate proteoglycan biosynthetic process, enzymatic modification (GO:0015015)",1/6,0.3980212693076621,0.999995545160402,0,0,2.2668723010487355,2.0883557325230564,HS6ST2
GO_Biological_Process_2021,histone H4-K12 acetylation (GO:0043983),1/6,0.3980212693076621,0.999995545160402,0,0,2.2668723010487355,2.0883557325230564,JADE2
GO_Biological_Process_2021,indolalkylamine metabolic process (GO:0006586),1/6,0.3980212693076621,0.999995545160402,0,0,2.2668723010487355,2.0883557325230564,TPH1
GO_Biological_Process_2021,intracellular pH elevation (GO:0051454),1/6,0.3980212693076621,0.999995545160402,0,0,2.2668723010487355,2.0883557325230564,BCL2
GO_Biological_Process_2021,L-arginine transmembrane transport (GO:1903400),1/6,0.3980212693076621,0.999995545160402,0,0,2.2668723010487355,2.0883557325230564,SLC25A29
GO_Biological_Process_2021,L-ornithine transmembrane transport (GO:1903352),1/6,0.3980212693076621,0.999995545160402,0,0,2.2668723010487355,2.0883557325230564,SLC25A29
GO_Biological_Process_2021,L-serine biosynthetic process (GO:0006564),1/6,0.3980212693076621,0.999995545160402,0,0,2.2668723010487355,2.0883557325230564,PSAT1
GO_Biological_Process_2021,lipoxin metabolic process (GO:2001300),1/6,0.3980212693076621,0.999995545160402,0,0,2.2668723010487355,2.0883557325230564,LTC4S
GO_Biological_Process_2021,lymphocyte apoptotic process (GO:0070227),1/6,0.3980212693076621,0.999995545160402,0,0,2.2668723010487355,2.0883557325230564,CLC
GO_Biological_Process_2021,maintenance of DNA methylation (GO:0010216),1/6,0.3980212693076621,0.999995545160402,0,0,2.2668723010487355,2.0883557325230564,DNMT1
GO_Biological_Process_2021,mesenchymal cell differentiation involved in kidney development (GO:0072161),1/6,0.3980212693076621,0.999995545160402,0,0,2.2668723010487355,2.0883557325230564,OSR1
GO_Biological_Process_2021,metanephric collecting duct development (GO:0072205),1/6,0.3980212693076621,0.999995545160402,0,0,2.2668723010487355,2.0883557325230564,PTCH1
GO_Biological_Process_2021,mitochondrial protein catabolic process (GO:0035694),1/6,0.3980212693076621,0.999995545160402,0,0,2.2668723010487355,2.0883557325230564,AFG1L
GO_Biological_Process_2021,monoterpenoid metabolic process (GO:0016098),1/6,0.3980212693076621,0.999995545160402,0,0,2.2668723010487355,2.0883557325230564,CYP1A2
GO_Biological_Process_2021,negative regulation of amyloid precursor protein biosynthetic process (GO:0042985),1/6,0.3980212693076621,0.999995545160402,0,0,2.2668723010487355,2.0883557325230564,AGO2
GO_Biological_Process_2021,negative regulation of anion transport (GO:1903792),1/6,0.3980212693076621,0.999995545160402,0,0,2.2668723010487355,2.0883557325230564,GABRE
GO_Biological_Process_2021,negative regulation of B cell receptor signaling pathway (GO:0050859),1/6,0.3980212693076621,0.999995545160402,0,0,2.2668723010487355,2.0883557325230564,LPXN
GO_Biological_Process_2021,negative regulation of glial cell proliferation (GO:0060253),1/6,0.3980212693076621,0.999995545160402,0,0,2.2668723010487355,2.0883557325230564,RNF10
GO_Biological_Process_2021,negative regulation of glucocorticoid receptor signaling pathway (GO:2000323),1/6,0.3980212693076621,0.999995545160402,0,0,2.2668723010487355,2.0883557325230564,CRY1
GO_Biological_Process_2021,negative regulation of lipoprotein particle clearance (GO:0010985),1/6,0.3980212693076621,0.999995545160402,0,0,2.2668723010487355,2.0883557325230564,KHSRP
GO_Biological_Process_2021,negative regulation of neuron migration (GO:2001223),1/6,0.3980212693076621,0.999995545160402,0,0,2.2668723010487355,2.0883557325230564,SRGAP2
GO_Biological_Process_2021,negative regulation of serine-type peptidase activity (GO:1902572),1/6,0.3980212693076621,0.999995545160402,0,0,2.2668723010487355,2.0883557325230564,ANXA8
GO_Biological_Process_2021,negative regulation of transporter activity (GO:0032410),1/6,0.3980212693076621,0.999995545160402,0,0,2.2668723010487355,2.0883557325230564,WWP2
GO_Biological_Process_2021,nephric duct morphogenesis (GO:0072178),1/6,0.3980212693076621,0.999995545160402,0,0,2.2668723010487355,2.0883557325230564,OSR1
GO_Biological_Process_2021,nephron tubule development (GO:0072080),1/6,0.3980212693076621,0.999995545160402,0,0,2.2668723010487355,2.0883557325230564,OSR1
GO_Biological_Process_2021,neurotransmitter loading into synaptic vesicle (GO:0098700),1/6,0.3980212693076621,0.999995545160402,0,0,2.2668723010487355,2.0883557325230564,SLC17A6
GO_Biological_Process_2021,norepinephrine biosynthetic process (GO:0042421),1/6,0.3980212693076621,0.999995545160402,0,0,2.2668723010487355,2.0883557325230564,MOXD1
GO_Biological_Process_2021,nuclear polyadenylation-dependent ncRNA catabolic process (GO:0071046),1/6,0.3980212693076621,0.999995545160402,0,0,2.2668723010487355,2.0883557325230564,EXOSC10
GO_Biological_Process_2021,nuclear polyadenylation-dependent rRNA catabolic process (GO:0071035),1/6,0.3980212693076621,0.999995545160402,0,0,2.2668723010487355,2.0883557325230564,EXOSC10
GO_Biological_Process_2021,nuclear polyadenylation-dependent tRNA catabolic process (GO:0071038),1/6,0.3980212693076621,0.999995545160402,0,0,2.2668723010487355,2.0883557325230564,EXOSC10
GO_Biological_Process_2021,peripheral nervous system neuron development (GO:0048935),1/6,0.3980212693076621,0.999995545160402,0,0,2.2668723010487355,2.0883557325230564,ETV1
GO_Biological_Process_2021,photoreceptor cell outer segment organization (GO:0035845),1/6,0.3980212693076621,0.999995545160402,0,0,2.2668723010487355,2.0883557325230564,MFSD2A
GO_Biological_Process_2021,piRNA biosynthetic process (GO:1990511),1/6,0.3980212693076621,0.999995545160402,0,0,2.2668723010487355,2.0883557325230564,PIWIL2
GO_Biological_Process_2021,plasma membrane raft assembly (GO:0044854),1/6,0.3980212693076621,0.999995545160402,0,0,2.2668723010487355,2.0883557325230564,PACSIN2
GO_Biological_Process_2021,polyphosphate metabolic process (GO:0006797),1/6,0.3980212693076621,0.999995545160402,0,0,2.2668723010487355,2.0883557325230564,BNIP2
GO_Biological_Process_2021,positive regulation of cell-cell adhesion mediated by integrin (GO:0033634),1/6,0.3980212693076621,0.999995545160402,0,0,2.2668723010487355,2.0883557325230564,SKAP1
GO_Biological_Process_2021,positive regulation of cholesterol metabolic process (GO:0090205),1/6,0.3980212693076621,0.999995545160402,0,0,2.2668723010487355,2.0883557325230564,FGF1
GO_Biological_Process_2021,positive regulation of cholesterol storage (GO:0010886),1/6,0.3980212693076621,0.999995545160402,0,0,2.2668723010487355,2.0883557325230564,APOB
GO_Biological_Process_2021,positive regulation of deacetylase activity (GO:0090045),1/6,0.3980212693076621,0.999995545160402,0,0,2.2668723010487355,2.0883557325230564,FNTA
GO_Biological_Process_2021,positive regulation of focal adhesion disassembly (GO:0120183),1/6,0.3980212693076621,0.999995545160402,0,0,2.2668723010487355,2.0883557325230564,IQSEC1
GO_Biological_Process_2021,positive regulation of growth hormone secretion (GO:0060124),1/6,0.3980212693076621,0.999995545160402,0,0,2.2668723010487355,2.0883557325230564,ADCYAP1
GO_Biological_Process_2021,positive regulation of hemoglobin biosynthetic process (GO:0046985),1/6,0.3980212693076621,0.999995545160402,0,0,2.2668723010487355,2.0883557325230564,SLC25A37
GO_Biological_Process_2021,positive regulation of microglial cell activation (GO:1903980),1/6,0.3980212693076621,0.999995545160402,0,0,2.2668723010487355,2.0883557325230564,TTBK1
GO_Biological_Process_2021,positive regulation of natural killer cell mediated cytotoxicity directed against tumor cell target (GO:0002860),1/6,0.3980212693076621,0.999995545160402,0,0,2.2668723010487355,2.0883557325230564,PVR
GO_Biological_Process_2021,positive regulation of natural killer cell mediated immune response to tumor cell (GO:0002857),1/6,0.3980212693076621,0.999995545160402,0,0,2.2668723010487355,2.0883557325230564,PVR
GO_Biological_Process_2021,positive regulation of plasminogen activation (GO:0010756),1/6,0.3980212693076621,0.999995545160402,0,0,2.2668723010487355,2.0883557325230564,PLGRKT
GO_Biological_Process_2021,positive regulation of T cell differentiation in thymus (GO:0033089),1/6,0.3980212693076621,0.999995545160402,0,0,2.2668723010487355,2.0883557325230564,ADAM8
GO_Biological_Process_2021,positive regulation of tau-protein kinase activity (GO:1902949),1/6,0.3980212693076621,0.999995545160402,0,0,2.2668723010487355,2.0883557325230564,EGR1
GO_Biological_Process_2021,positive regulation of toll-like receptor 7 signaling pathway (GO:0034157),1/6,0.3980212693076621,0.999995545160402,0,0,2.2668723010487355,2.0883557325230564,SLC15A4
GO_Biological_Process_2021,postsynaptic density assembly (GO:0097107),1/6,0.3980212693076621,0.999995545160402,0,0,2.2668723010487355,2.0883557325230564,NLGN2
GO_Biological_Process_2021,prepulse inhibition (GO:0060134),1/6,0.3980212693076621,0.999995545160402,0,0,2.2668723010487355,2.0883557325230564,GRID2
GO_Biological_Process_2021,pronephros development (GO:0048793),1/6,0.3980212693076621,0.999995545160402,0,0,2.2668723010487355,2.0883557325230564,OSR1
GO_Biological_Process_2021,protection from natural killer cell mediated cytotoxicity (GO:0042270),1/6,0.3980212693076621,0.999995545160402,0,0,2.2668723010487355,2.0883557325230564,SERPINB9
GO_Biological_Process_2021,protein geranylgeranylation (GO:0018344),1/6,0.3980212693076621,0.999995545160402,0,0,2.2668723010487355,2.0883557325230564,FNTA
GO_Biological_Process_2021,protein K27-linked ubiquitination (GO:0044314),1/6,0.3980212693076621,0.999995545160402,0,0,2.2668723010487355,2.0883557325230564,UBE2D4
GO_Biological_Process_2021,protein K29-linked ubiquitination (GO:0035519),1/6,0.3980212693076621,0.999995545160402,0,0,2.2668723010487355,2.0883557325230564,UBE2D4
GO_Biological_Process_2021,protein localization to ciliary transition zone (GO:1904491),1/6,0.3980212693076621,0.999995545160402,0,0,2.2668723010487355,2.0883557325230564,SPATA7
GO_Biological_Process_2021,protein localization to non-motile cilium (GO:0097499),1/6,0.3980212693076621,0.999995545160402,0,0,2.2668723010487355,2.0883557325230564,SPATA7
GO_Biological_Process_2021,protein sulfation (GO:0006477),1/6,0.3980212693076621,0.999995545160402,0,0,2.2668723010487355,2.0883557325230564,UST
GO_Biological_Process_2021,purine deoxyribonucleotide catabolic process (GO:0009155),1/6,0.3980212693076621,0.999995545160402,0,0,2.2668723010487355,2.0883557325230564,PNP
GO_Biological_Process_2021,purine ribonucleoside bisphosphate biosynthetic process (GO:0034036),1/6,0.3980212693076621,0.999995545160402,0,0,2.2668723010487355,2.0883557325230564,PAPSS2
GO_Biological_Process_2021,purine ribonucleoside catabolic process (GO:0046130),1/6,0.3980212693076621,0.999995545160402,0,0,2.2668723010487355,2.0883557325230564,PNP
GO_Biological_Process_2021,regulation of 3'-UTR-mediated mRNA stabilization (GO:1905868),1/6,0.3980212693076621,0.999995545160402,0,0,2.2668723010487355,2.0883557325230564,TENT4A
GO_Biological_Process_2021,regulation of adiponectin secretion (GO:0070163),1/6,0.3980212693076621,0.999995545160402,0,0,2.2668723010487355,2.0883557325230564,RAB11FIP1
GO_Biological_Process_2021,regulation of cell cycle checkpoint (GO:1901976),1/6,0.3980212693076621,0.999995545160402,0,0,2.2668723010487355,2.0883557325230564,CRY1
GO_Biological_Process_2021,regulation of excitatory synapse assembly (GO:1904889),1/6,0.3980212693076621,0.999995545160402,0,0,2.2668723010487355,2.0883557325230564,WNT7A
GO_Biological_Process_2021,regulation of focal adhesion disassembly (GO:0120182),1/6,0.3980212693076621,0.999995545160402,0,0,2.2668723010487355,2.0883557325230564,IQSEC1
GO_Biological_Process_2021,regulation of glomerular filtration (GO:0003093),1/6,0.3980212693076621,0.999995545160402,0,0,2.2668723010487355,2.0883557325230564,PTPRO
GO_Biological_Process_2021,regulation of glucokinase activity (GO:0033131),1/6,0.3980212693076621,0.999995545160402,0,0,2.2668723010487355,2.0883557325230564,MIDN
GO_Biological_Process_2021,regulation of glutamate receptor signaling pathway (GO:1900449),1/6,0.3980212693076621,0.999995545160402,0,0,2.2668723010487355,2.0883557325230564,FRRS1L
GO_Biological_Process_2021,regulation of hormone biosynthetic process (GO:0046885),1/6,0.3980212693076621,0.999995545160402,0,0,2.2668723010487355,2.0883557325230564,EGR1
GO_Biological_Process_2021,regulation of membrane tubulation (GO:1903525),1/6,0.3980212693076621,0.999995545160402,0,0,2.2668723010487355,2.0883557325230564,ASAP1
GO_Biological_Process_2021,regulation of mRNA export from nucleus (GO:0010793),1/6,0.3980212693076621,0.999995545160402,0,0,2.2668723010487355,2.0883557325230564,IWS1
GO_Biological_Process_2021,regulation of neutrophil extravasation (GO:2000389),1/6,0.3980212693076621,0.999995545160402,0,0,2.2668723010487355,2.0883557325230564,ADAM8
GO_Biological_Process_2021,regulation of non-motile cilium assembly (GO:1902855),1/6,0.3980212693076621,0.999995545160402,0,0,2.2668723010487355,2.0883557325230564,SEPTIN9
GO_Biological_Process_2021,regulation of nucleotide-binding oligomerization domain containing 2 signaling pathway (GO:0070432),1/6,0.3980212693076621,0.999995545160402,0,0,2.2668723010487355,2.0883557325230564,SLC15A4
GO_Biological_Process_2021,regulation of protein localization to cilium (GO:1903564),1/6,0.3980212693076621,0.999995545160402,0,0,2.2668723010487355,2.0883557325230564,CROCC
GO_Biological_Process_2021,regulation of response to reactive oxygen species (GO:1901031),1/6,0.3980212693076621,0.999995545160402,0,0,2.2668723010487355,2.0883557325230564,DHFR
GO_Biological_Process_2021,"regulation of retrograde transport, endosome to Golgi (GO:1905279)",1/6,0.3980212693076621,0.999995545160402,0,0,2.2668723010487355,2.0883557325230564,ATP9A
GO_Biological_Process_2021,regulation of ribonucleoprotein complex localization (GO:2000197),1/6,0.3980212693076621,0.999995545160402,0,0,2.2668723010487355,2.0883557325230564,IWS1
GO_Biological_Process_2021,regulation of serine-type endopeptidase activity (GO:1900003),1/6,0.3980212693076621,0.999995545160402,0,0,2.2668723010487355,2.0883557325230564,ANXA8
GO_Biological_Process_2021,regulation of SNARE complex assembly (GO:0035542),1/6,0.3980212693076621,0.999995545160402,0,0,2.2668723010487355,2.0883557325230564,SEPTIN8
GO_Biological_Process_2021,regulation of superoxide metabolic process (GO:0090322),1/6,0.3980212693076621,0.999995545160402,0,0,2.2668723010487355,2.0883557325230564,DHFR
GO_Biological_Process_2021,regulation of thymocyte apoptotic process (GO:0070243),1/6,0.3980212693076621,0.999995545160402,0,0,2.2668723010487355,2.0883557325230564,ADAM8
GO_Biological_Process_2021,regulation of translational elongation (GO:0006448),1/6,0.3980212693076621,0.999995545160402,0,0,2.2668723010487355,2.0883557325230564,EIF5AL1
GO_Biological_Process_2021,renal filtration cell differentiation (GO:0061318),1/6,0.3980212693076621,0.999995545160402,0,0,2.2668723010487355,2.0883557325230564,PTPRO
GO_Biological_Process_2021,renal system process involved in regulation of blood volume (GO:0001977),1/6,0.3980212693076621,0.999995545160402,0,0,2.2668723010487355,2.0883557325230564,PTPRO
GO_Biological_Process_2021,response to catecholamine (GO:0071869),1/6,0.3980212693076621,0.999995545160402,0,0,2.2668723010487355,2.0883557325230564,NR4A3
GO_Biological_Process_2021,response to DNA damage checkpoint signaling (GO:0072423),1/6,0.3980212693076621,0.999995545160402,0,0,2.2668723010487355,2.0883557325230564,MUS81
GO_Biological_Process_2021,response to heparin (GO:0071503),1/6,0.3980212693076621,0.999995545160402,0,0,2.2668723010487355,2.0883557325230564,EGR1
GO_Biological_Process_2021,response to lipoteichoic acid (GO:0070391),1/6,0.3980212693076621,0.999995545160402,0,0,2.2668723010487355,2.0883557325230564,CD14
GO_Biological_Process_2021,taurine metabolic process (GO:0019530),1/6,0.3980212693076621,0.999995545160402,0,0,2.2668723010487355,2.0883557325230564,STAT5B
